,user_account,tweet,tweet_clean,label
301,@Panigoro7,"Mendirikan usaha jadi lebih mudah

Sblm disahkannya RUU Cipta Kerja, utk mendirikan PT hrs menyetorkan uang krg lbh 50 an jt 

Hal ini dihapuskan sehingga byk UMKM bs jadi PT resmi dgn mdh tanpa birokrasi yg ribet
#KadrunMakarTunggangiOBL",diri usaha mudah sah rancang undang undang cipta kerja diri pt setor uang an juta hapus usaha mikro tengah pt resmi mudah birokrasi ribet,1
302,@LILApama2011,"UU Cipta Kerja transparan. 
Transparansi tersebut, dikatakan Airlangga penting untuk menjawab penolakan dari Fraksi Demokrat dan Fraksi PKS yang menyampaikan bahwa RUU Cipta Kerja belum mendesak.

#OmnibusLawTransparan",undang undang cipta kerja transparan transparansi airlangga tolak fraksi demokrat fraksi pks rancang undang undang cipta kerja desak,1
303,@James_Pardi,"JAKARTA RUSAK AKIBAT DEMO RUU CIPTA KERJA / OMNIBUS LAW CAPAI 100 MILIAR... https://youtu.be/nZJ9HrAt4GI via 
@YouTube
 Innalillahi #LightUpTheSky
 Arab Saudi #RakyatInginJokowiTumbang #kwitang #UMMCampus 14 Oktober #KAMIFPISampahNKRI #BawasluMulaiGalak #momenemas *10JAKARTA RUSAK AKIBAT DEMO RUU CIPTA KERJA / OMNIBUS LAW CAPAI 100...
Demo RUU CIPTA KERJA / OMNIBUS LAW yang terjadi pada Kamis 08 Oktober 2020 menyisakan kerusakan. Kerusakan terpantau dari Patung Kuda Jakarta Pusat sampai Jl...
youtube.com",jakarta rusak akibat demo rancang undang undang cipta kerja omnibus law capai miliar,0
304,@idtodayco,"AHY Heran Draf RUU Cipta Kerja Berubah-ubah: Saling Tuding Sebar HoaksAHY Heran Draf RUU Cipta Kerja Berubah-ubah: Saling Tuding Sebar Hoaks
IDTODAY NEWS - Ketum Demokrat Agus Harimurti Yudhoyono atau AHY menyoroti perubahan jumlah halaman draf UU Cipta Kerja yang terus berubah-ubah sejak masih menjadi RUU. AHY mengatakan seharusnya draf...
news.idtoday.co",heran draf rancang undang undang cipta kerja ubah ubah tuding sebar hoax heran draf rancang undang undang cipta kerja ubah ubah tuding sebar hoax idtoday news tum demokrat agus harimurti yudhoyono sorot ubah halaman draf undang undang cipta kerja ubah ubah rancang undang undang draf news idtoday,0
305,@utha_08,"Nonton mata najwa di youtube tentang RUU Cipta Kerja sumpah ngeri bgt 
 yg blom liat jgn liat rek 
 
Bercanda bos, monggo tonton aja...
Aku habis nonton kepalaku langsung panas, mbuh gara"" ra nutut utekku opo mangkel opo emosi ",tonton mata najwa youtube rancang undang undang cipta kerja sumpah ngeri banget lihat lihat canda bos silah tonton habis tonton kepala langsung panas tau gara otak mangkel emosi,1
306,@andrywaseso,"Yg bilang RUU Cipta Kerja akan menciptakan lapangan kerja.Tweet Kutipan
Dedek Prayudi - Uki || ig: @uki_dedek
@Uki23
 · 13 Okt
Kemaren RUU Cipta Kerja dibilang neo lib.

Hari ini RUU Cipta Kerja dibilang komunis.

Jadi yang bener yang mana?",bilang rancang undang undang cipta kerja cipta lapang kerja tweet kutip adik prayudi uki instagram oktober kemarin rancang undang undang cipta kerja bilang neo lib rancang undang undang cipta kerja bilang komunis,1
307,@GreenpeaceID,"""Gerakan hati yang ngebuat aku turun ke aksi, karena sadar ada suatu hal yang mengganjal dari disahkannya RUU Cipta Kerja ini mulai dari dirancangnya UU tersebut sampai ke isinya"" https://greenpeace.org/indonesia/cerita/44071/dari-jogja-hingga-jakarta-cerita-mahasiswa-yang-menolak-uu-cipta-kerja/… #TolakOmnibusLaw #MosiTidakPercayaDari Jogja hingga Jakarta, Cerita Mahasiswa yang menolak UU Cipta Kerja - Greenpeace Indonesia
Seperti yang diungkapkan, MP, “Gerakan hati yang ngebuat aku turun ke aksi, karna sadar ada suatu hal yang mengganjal dari disahkannya RUU Cipta Kerja ini mulai dari dirancangnya UU tersebut sampai...
greenpeace.org",gera hati turun aksi sadar ganjal sah rancang undang undang cipta kerja rancang undang undang isi,0
308,@GarudaRonald,"Membalas 
@03__nakula
 @EKemarok
  dan 5 lainnyaSemoga setelah kemarin cipta kerja kini saatna giliran RUU BPIP

#SegeraSAHkanUUBPIP",balas moga kemarin cipta kerja gilir rancang undang undang badan bina ideologi pancasila,1
309,@kemenkomarves,"Prosedur Program Legislasi Nasional (Prolegnas) dan pembahasan RUU Cipta Kerja ditaati oleh DPR RI, DPD RI, dan Pemerintah. 

#Timmarves bisa cek tautan http://dpr.go.id/uu/detail/id/4…

#OmnibusLawTaatProsedur 
#CiptaKerja 
#UntukEkonomiIndonesia",prosedur program legislasi nasional program legislatif nasional bahas rancang undang undang cipta kerja taat dewan wakil rakyat rakyat indonesia dewan wakil daerah rakyat indonesia perintah cek taut,1
310,@MalvaSelena,"Dalam pembahasan RUU Cipta Kerja juga melibatkan buruh dan serikat pekerja.
#OmnibusLawTaatProsedural",bahas rancang undang undang cipta kerja libat buruh serikat kerja,1
311,@Jitelu03,"Tahapan Penyusunan Undang Undang Cipta Kerja

Presiden menyampaikan RUU Cipta Kerja kepada DPR RI

#OmnibusLawTaatProsedural

Yuk dibaca ",tahap susun undang undang cipta kerja presiden rancang undang undang cipta kerja dewan wakil rakyat rakyat indonesia ayo baca,1
312,@justafreakygirl,"Jawaban untuk Bagaimana pendapat Anda tentang disahkannnya RUU Cipta Kerja / Omnimbus Law? Mengapa banyak yang menentang? oleh M ArkandiptyoBagaimana pendapat Anda tentang disahkannnya RUU Cipta Kerja / Omnimbus Law? Mengapa banyak yang...
Jawaban M Arkandiptyo: Saya bahas contoh dari satu pasal saja ya, udah panjang banget loh soalnya. Bukan, bukan soal hak-hak buruh atau DPR yang oportunis… saya kira sudah banyak yang bahas - yang...
id.quora.com",dapat sah rancang undang undang cipta kerja omnibus law law tentang m arkan diptyo dapat sah rancang undang undang cipta kerja omnibus law law m arkandiptyo bahas contoh pasal ya banget hak hak buruh dewan wakil rakyat oportunis bahas,1
313,@mulanbilqis,"Tudingan sejumlah orang soal RUU Cipta Kerja dibuat secara sembunyi2 sama sekali tidak benar.

Sejak dikirimkan ke DPR pada 12 Februari 2020, RUU ini terus dibahas secara transparan.

Dan pembahasan itu sudah sesuai dg mekanisme yg berlaku.

Tahap Awal
#OmnibusLawTaatProsedural",tuding orang rancang undang undang cipta kerja kirim dewan wakil rakyat februari rancang undang undang bahas transparan bahas sesuai mekanisme laku tahap,1
314,@1106Yeye,"Pro dan kontra UU Cipta Kerja telah bermunculan. 
Maka dari itu seperti yg disampaikan Menaker bahwa Pembahasan RUU Cipta Kerja dilakukan Secara Demokratis dan Transparan
##OmnibusLawTransparan",pro kontra undang undang cipta kerja muncul menteri ketenagakerjaan bahas rancang undang undang cipta kerja demokratis transparan omnibus law transparan,1
315,@MeongEmpus,"Mari bicara bertatap Negara yang baik. 

RUU Cipta Kerja itu INKONSTITUSIONAL yang langgar hukum adalah yang melakukan Inkonstitusional,  betul 
Rakyat menuntut Hak dan dilindungi Konstitusi. 

Jadilah orang yang bijaksana. 
Dunia Internasional memantau tulisan ini. Tweet Kutipan
JPNN.com
@jpnncom
 · 13 Okt
Bang Edi mendukung langkah Polri mengusut tuntas pelaku penjarahan dan pelaku ujaran kebencian dalam aksi unjuk rasa menentang RUU Cipta Kerja. #RUUCiptaKerja https://m.jpnn.com/news/usut-tuntas-pelaku-penjarahan-dan-ujaran-kebencian-dalam-aksi-menolak-ruu-cipta-kerja…",mari bicara tatap negara rancang undang undang cipta kerja inkonstitusional langgar hukum inkonstitusional rakyat tuntut hak lindung konstitusi orang bijaksana dunia internasional pantau tulis tweet kutip oktober bang edi dukung langkah polri usut tuntas laku jarah laku ujar benci aksi unjuk tentang rancang undang undang cipta kerja,1
316,@PrastSuryo,"Membalas 
@KathleeNugroho
 dan 
@rahardiani_Alll provider kayake,efek ruu cipta kerja",balas provider kayak efek rancang undang undang cipta kerja,1
317,@HukumOnline,"Setidaknya ada 4 pelanggaran prosedur mulai dari penyusunan, pembahasan pengesahan RUU Cipta Kerja.Pelanggaran Prosedur dapat Membuat UU Cipta Kerja Batal Oleh: Rizky Argama*)
Setidaknya ada 4 pelanggaran prosedur mulai dari penyusunan, pembahasan pengesahan RUU Cipta Kerja.
hukumonline.com",langgar prosedur susun bahas kesah rancang undang undang cipta kerja langgar prosedur undang undang cipta kerja batal rizky agama langgar prosedur susun bahas kesah rancang undang undang cipta kerja,1
318,@Rereblu,RUU Cipta Kerja telah dapat diselesaikan oleh Pemerintah dan DPR melalui pembahasan yang intensif dan dilakukan secara terbuka. #OmnibusLawTransparan,rancang undang undang cipta kerja selesai perintah dewan wakil rakyat bahas intensif buka,1
319,@Hamzah_Saputraa,"Bertempat di Gedung Utama Kementerian Sekretariat Negara (Kemensetneg), Sekretaris Jenderal Dewan Perwakilan Rakyat Republik Indonesia (Sekjen DPR RI) Indra Iskandar hadir untuk menyerahkan Draf Final Rancangan Undang-Undang (RUU) Cipta Kerja ke Kemensetneg.",tempat gedung utama menteri sekretariat negara kemensetneg sekretaris jenderal dewan wakil rakyat republik indonesia sekjen dewan wakil rakyat rakyat indonesia indra iskandar hadir serah draf final rancang undang undang rancang undang undang cipta kerja kemensetneg,1
320,@yudi_pr,"Membandingkan 3 Draf RUU Cipta Kerja: Ada Perbedaan Ketentuan Cuti, Upah, dan PHK
Klik untuk baca: http://kmp.im/AGA860

Download aplikasi http://Kompas.com untuk akses berita lebih mudah dan cepat:
Android: https://bit.ly/39CkIQ0
iOS:KOMPAS.com: Berita Terpercaya
KOMPAS.com - Jernih Melihat Dunia Baca Berita Indonesia Terkini, Akurat, dan Terpercaya di Aplikasi Kompas.com. Lebih dari 50 tahun Kompas menemani Indonesia dengan memberikan berita-berita terkini,...
4.03571/5.0 stars – 56 ratings",banding draf rancang undang undang cipta kerja beda tentu cuti upah phk klik baca,1
321,@Panpanbb,"Dalam Undang-Undang Nomor 32 Tahun 2009 tentang Perlindungan dan Pengelolaan Lingkungan Hidup (UU PPLH) dapat menjerat pelaku pembakar hutan dan lahan (karhutla) tetapi pemerintah menghapusnya di RUU Cipta Kerja. sDaftar Pasal Bermasalah RUU Cipta Kerja Pemicu Demo 6-8 Oktober - Tirto.ID
Pasal bermasalah dalam Omnibus Law RUU Cipta Kerja yang mencakup tentang ketenagakerjaan, Pendidikan, Pers hingga Lingkungan Hidup.
tirto.id",undang undang nomor tahi lindung kelola lingkung hidup undang undang lindung kelola lingkung hidup jerat laku bakar hutan lahan karhutla perintah hapus rancang undang undang cipta kerja daftar pasal masalah rancang undang undang cipta kerja picu demo oktober tirto pasal masalah omnibus law rancang undang undang cipta kerja cakup ketenagakerjaan didik pers lingkung hidup tirto,1
322,@charliakbar_id,"Membalas 
@BadarSallam_9Demo penolakan RUU Cipta Lapangan Kerja,dar.",balas tolak rancang undang undang cipta lapang kerja,0
323,@hey_zall,"Ohh.. Jadi semua element masyarakat yang tergabung dalam aksi demonstrasi MENOLAK RUU CIPTA KERJA sampai saat ini karena terkena hoaks ya pak? 
. Trus klo MENYETUJUI RUU TANPA ADANYA NASKAH bukan sebuah hoaks ya pak? 
 yg bego yg mane siTweet Kutipan
TRANS7
@TRANS7
 · 14 Okt
Mahasiswa melakukan demonstrasi karena terkena hoaks? Ini jawaban Remy Hastian, Ketua BEM Seluruh Indonesia. #MataNajwaCiptaKerjaManaFaktaManaDusta #MataNajwa",oh elemen masyarakat gabung aksi demonstrasi tolak rancang undang undang cipta kerja kena hoax ya tuju rancang undang undang naskah hoax ya bodoh si tweet kutip oktober mahasiswa demonstrasi kena hoax remy hastian ketua bem indonesia,0
324,@primandanii,"Awiek menerangkan rincian pertemuan-pertemuan bersama serikat buruh dalam pembahasan RUU Omnibus Law Cipta Kerja yang tidak hanya dilakukan satu kali

#OmnibusLawTaatProsedural",terang rincian temu temu serikat buruh bahas rancang undang undang omnibus law cipta kerja kali,1
325,@fktmb,"Walhi Masih Temukan Pasal Bermasalah pada Draf Final RUU Cipta KerjaWalhi Masih Temukan Pasal Bermasalah pada Draf Final RUU Cipta Kerja
'Terkait penghapusan izin lingkungan, pelemahan prinsip tanggung jawab mutlak dan pelemahan partisipasi publik, masih tetap demikian,' kata Nur.
nasional.kompas.com",walhi temu pasal masalah draf final rancang undang undang cipta kerja walhi temu pasal masalah draf final rancang undang undang cipta kerja kait hapus izin lingkung lemah prinsip tanggung mutlak lemah partisipasi publik nur nasional,0
326,@gitariiii,"Kalau mau membaca secara utuh sebenarnya gak perlu di perdebatkan lagi sih.. 
~Justru memberi peluang untuk buruh/pekerja lebih terlindungi.#OmnibusLawUntungkanBuruh
Airlangga: RUU Cipta Kerja Justru Untungkan BuruhAirlangga: RUU Cipta Kerja Justru Untungkan Buruh
Para pimpinan serikat buruh sudah sering diajak berdiskusi. Mereka pun dilibatkan dalam pembahasan RUU Ciptaker.
investor.id",baca utuh debat sih peluang buruh kerja lindung airlangga rancang undang undang cipta kerja untung buruh airlangga rancang undang undang cipta kerja untung buruh pimpin serikat buruh ajak diskus libat bahas rancang undang undang cipta kerja investor,1
327,@lukasomanalu,"Kalau benar, tidak mungkin sampai segila itu mereka mencatut nama Buya Syafii Maarif seolah merestui RUU Cipta Kerja. Tweet Kutipan
Budhi Hermanto
@budhihermanto
 · 13 Okt
Klarifikasi ya, wahai para pendukung omnibus law yang terhormat. Poster seolah Buya Maarif merestui RUU cipta Kerja, bukan dari Buya Syafii Maarif.
Tampilkan utas ini",gila catut nama buya syafii maarif restu rancang undang undang cipta kerja tweet kutip budhi hermanto oktober klarifikasi ya dukung omnibus law hormat poster buya maarif restu rancang undang undang cipta kerja buya syafii maarif tampil utas,1
328,@achmadphotogra,"Maka'a biar rakyat baca itu draf RUU Omnibus law cipta kerja di upload dong di situs pemerintah pusat biar rakyat tau gak terjebak hoax...Tweet Kutipan
VIVAcoid
@VIVAcoid
 · 13 Okt
Prabowo: yang Kemarin Demo Belum Baca Omnibus Law, Banyak Hoax http://dlvr.it/RjTW71",a biar rakyat baca draf rancang undang undang omnibus law cipta kerja upload situs perintah pusat biar rakyat jebak hoax tweet kutip vivacoid oktober prabowo kemarin demo baca omnibus law hoax,1
329,@bealiviana17,"Saat akan memasukan mereka ke ruu cipta kerja jadi bias sama ratakan dengan wonwoo. Bentar, aku perlu berfikit sedikit lagi.
APAH ?
.
.
sedikit lagi itu sama dengan kesempatan lebih banyak.
Padahal emang iyah, goods shua aja udah 30% banyak nya. Hehe:)",pasu rancang undang undang cipta kerja bias rata wonwoo bentar pikir sempat emang iya bagus shua,1
330,@LAPASTABANAN,"2. Secara resmi, Menteri 
@PerekonomianRI
 telah menetapkan Panitia Antar Kementerian dan/atau Antar NonKementerian dalam Penyusunan RUU tentang Cipta Lapangan Kerja padatanggal 23 Oktober 2019 yangdipimpin oleh SekretarisMenko

#KumhamPasti
#OmnibusLawTaatProsedural
#Kumham22",resmi menteri tetap panitia menteri nonkementerian susun rancang undang undang cipta lapang kerja tanggal oktober pimpin sekretaris menko,1
331,@AntoniusNiander,"Draf RUU Cipta Kerja Diperbarui Lagi, Berubah Jadi 812 Halaman

Download aplikasi http://Kompas.com untuk akses berita lebih mudah dan cepat: 
Android: https://bit.ly/39CkIQ0 
iOS: https://apple.co/2Pa5dFm

Klik untuk baca: https://nasional.kompas.com/read/2020/10/13/07043321/draf-ruu-cipta-kerja-diperbarui-lagi-berubah-jadi-812-halaman…Berita Terkini Hari Ini, Kabar Akurat Terpercaya - Kompas.com
Kompas.com - Berita Indonesia dan Dunia Terkini Hari Ini, Kabar Harian Terbaru Terpercaya Terlengkap Seputar Politik, Ekonomi, Travel, Teknologi, Otomotif, Bola
kompas.com",draf rancang undang undang cipta kerja baru ubah halaman download aplikasi,1
332,@kang_mul29,"Sebelum disahkannya RUU Cipta Kerja menjadi UU, proses pembahasannya sangat terbuka dan dilakukan transparan, bahkan melibatkan seluruh pihak dan pemangku kepentingan untk sama""  melakukan pembahasan di RUU tersebut.
@airlangga_hrt
@PerekonomianRI
#OmnibusLawTransparan",sah rancang undang undang cipta kerja undang undang proses bahas buka transparan libat mang penting bahas rancang undang undang,1
333,@Rerebaper,"Tuhhhh kan teman-teman pekerja aja mau menggugat RUU cipta kerja melalui MK, kelompok radikal yang selama ini menunggangi seluruh kegiatan demo...
Mereka muslim ga sich...!!!
#KadrunMakarTunggangiOBLPA 212 dkk Demo Omnibus Law, KSP Ungkit Rencana Buruh Gugat ke MK
""Jika masih ada keberatan silakan mengajukan judicial review seperti akan dilakukan teman-teman buruh itu lebih sehat, lebih rasional,"" kata Donny Gahral.
news.detik.com",teman teman kerja gugat rancang undang undang cipta kerja mahkamah konstitusi kelompok radikal tunggang giat demo muslim sih kawan kawan demo omnibus law kantor staf presiden ungkit rencana buruh gugat mahkamah konstitusi berat sila aju judicial review teman teman buruh sehat rasional donny gahral news,1
334,@HaytllhKhumaini,"Apa peramal sudah baca RUU Cipta kerjaTweet Kutipan
Muhammad Said Didu
@msaid_didu
 · 15 Okt
Hasil nyata twitter.com/CNNIndonesia/s…",amal baca rancang undang undang cipta kerja tweet kutip muhammad said oktober hasil nyata cnn indonesia s,1
335,@Febrian43911224,"Anggota Baleg perjuangkan BUMDes di desa-desa tanah air dalam pembahasan kluster kemudahan berusaha dalam RUU Cipta Kerja. 
#indonesiamaju #indonesiakerja #OMNIBUSLAW #Omnibuslawjadisolusi #UUCiptaKerja #ciptakerja #rakyatbanturakyat",anggota baleg juang bumdes desa desa tanah air bahas kluster mudah usaha rancang undang undang cipta kerja,1
336,@envisauce,"Membalas 
@ngalammenfessDapuranmu koyok ruu cipta kerja. Mbulet.",balas kayak rancang undang undang cipta kerja bulat,0
337,@ChristWamea,"SBY mengungkapkan alasan Partai Demokrat menolak pengesahan RUU Cipta Kerja menjadi undang-undang. / #NasionalSBY Jelaskan Alasan Partai Demokrat Tolak Pengesahan RUU Cipta Kerja
SBY mengungkapkan alasan Partai Demokrat menolak pengesahan RUU Cipta Kerja menjadi undang-undang.
nasional.kompas.com",susilo bambang yudhoyono alas partai demokrat tolak kesah rancang undang undang cipta kerja undang undang alas partai demokrat tolak kesah rancang undang undang cipta kerja susilo bambang yudhoyono alas partai demokrat tolak kesah rancang undang undang cipta kerja undang undang nasional,1
338,@hendryx691,"HahahahahahahahahahahahahaHahahahahahahahahahahahahaHahahahahahahahahahahahahaHahahahahahahahahahaha . . . 

iyak, iyaaak, iyaaaaaaaaaaaaakh

kl anak g mo ngalah sama bapaknya ya kek gini!!!?
GP Ansor: Omnibus Law Cipta Kerja RUU yang Tidak JujurGP Ansor: Omnibus Law Cipta Kerja RUU yang Tidak Jujur
Yaqut Cholil Coumas menyebut RUU Ciptaker lebih pantas disebut RUU Investasi, karena mengutamakan investasi daripada tenaga kerja.
cnnindonesia.com",iya iya iya anak g kalah bapak ya kayak gin ansor omnibus law cipta kerja rancang undang undang jujur gp ansor omnibus law cipta kerja rancang undang undang jujur yaqut cholil coumas sebut rancang undang undang cipta kerja rancang undang undang investasi utama investasi tenaga kerja,0
339,@BLKSamarinda,MENAKER Ida - Deddy Corbuzier debat RUU Cipta Kerja #stophoax #RUUCiptaKerja https://instagram.com/p/CGWqMlGJCUd/?igshid=567zdac11tij…,menteri ketenagakerjaan ida deddy corbuzier debat rancang undang undang cipta kerja,1
340,@srianazis,"VIRAL TERBARU HARI INI ~ GUBERNUR TAK DUKUNG RUU CIPTA KERJA INFO NEWS T... https://youtu.be/oYG3ziVOYvU lewat 
@YouTube
 ALLAHUAKBAR MERDEKA ATAU MATIVIRAL TERBARU HARI INI ~ GUBERNUR TAK DUKUNG RUU CIPTA KERJA INFO...
""KUMPULAN BERITA TERBARU"" BERITA BARU HARI INI BERITA TERBARU HARI INI BERITA TERKINI HARI INI BERITA SIANG HARI INI BERITA MALAM INI BERITA PALING AKTUAL HA...
youtube.com",viral baru gubernur dukung rancang undang undang cipta kerja informasi news t,0
341,@B31019,"Bagi semua saudaraku Seiman dan Sebangsa, jika ada anak atau saudara yang mengikuti aksi ""PENOLAKAN RUU CIPTA KERJA"" dan sampai saat ini blm kembali ke rumah. Bisa menghubungi :
1.Habib Ali Alatas(085888008944)
2.Ust. Mikhdan(081318201100)
Utk konsultasi/pendampingan HukumTweet Kutipan
Haikal Hassan Baras
@haikal_hassan
 · 15 Okt
Laporkan...",saudara iman bangsa anak saudara ikut aksi tolak rancang undang undang cipta kerja rumah hubung habib ali alatas ustaz mikhdan konsultasi damping hukum tweet kutip haikal hassan baras oktober lapor,0
342,@DivaJaritaKiran,"Membalas 
@geloracoKPK apa kabar harun masiku?? RUU Ciptakerja sisa menunggu kejadian..

BERHENTILAH KALIAN NGIBUL

September meroket Utang Indonesia.",balas kabar harun mas rancang undang undang cipta kerja sisa tunggu jadi henti ibul september roket utang indonesia,0
343,@dampiero10,"Membalas 
@kkangjulPasal 121 RUU Cipta Kerja yang mengubah Pasal 8 dan Pasal 10 Undang-Undang Nomor 12 tahun 2012 tentang Pengadaan Tanah Bagi Pembangunan Untuk Kepentingan Umum, Pengaturan Bank Tanah Pasal 125-135",balas rancang undang undang cipta kerja ubah pasal pasal undang undang nomor tahi ada tanah bangun penting atur bank tanah pasal,1
344,@djaritakirana,"Kalau aksi demo tolak RUU ciptakerja ditunggangi asing kenapa yg ditangkap rakyat pribumi pak menhan???

""MAU PUTAR BALIKKAN FAKTA""

Lebih masuk akal pemerintah & DPR lah yg ditunggangi cukong asing untuk mengsahkan RUU ciptakerja itu, (SANGAT LOGIS)..Menhan Prabowo Sebut Ada Kekuatan Asing di Balik Demo Omnibus Law
Menurut Prabowo, banyak peserta aksi unjuk rasa belum membaca naskah omnibus law itu dan termakan hoaks.
nasional.tempo.co",aksi demo tolak rancang undang undang cipta kerja tunggang asing tangkap rakyat pribumi menteri tahan putar balik fakta masuk akal perintah dewan wakil rakyat tunggang cukong asing kesah rancang undang undang cipta kerja logis menteri tahan prabowo kuat asing demo omnibus law prabowo serta aksi unjuk baca naskah omnibus law makan hoax nasional tempo,0
345,@Crew_ZamzamI,"Buzzer berkeliaran membuat #OmnibusLawBermanfaat ,Hay DPR!!!!!
Kenapa orang demo klau bermanfaat,di sahkan RUU Cipta Kerja sj mlam2 dan gak bisa di Intrupsi bagi yg Kontra RUU
Buzzer jgn pro kalangan atas,buzzer adlh pengkhianat Negara...
Rata2 akun buzzer adalah post nya sedikit",buzzer liar hay dewan wakil rakyat orang demo manfaat sah rancang undang undang cipta kerja interupsi kontra rancang undang undang buzzer pro kalang buzzer khianat negara akun buzzer post,0
346,@Duwiokta9,"Ditolak Buruh, Pemerintah Klaim Ada 9 Keuntungan RUU Omnibus Law Cipta Kerja bagi Masyarakat

#OBLBuatRakyatSejahteraDitolak Buruh, Pemerintah Klaim Ada 9 Keuntungan RUU Omnibus Law Cipta Kerja bagi Masyarakat »...
JAKARTA, JOGLOSEMARNEWS.COM – Pemerintah bersama dengan Dewan Perwakilan Rakyat (DPR) telah menyepakati Rancanan Undang-Undang (RUU) Ominbus Law Cipta Kerja. Selanjutnya, RUU tersebut bakal dibawa ke...
joglosemarnews.com",tolak buruh perintah klaim untung rancang undang undang omnibus law cipta kerja masyarakat buruh perintah klaim untung rancang undang undang omnibus law cipta kerja masyarakat jakarta joglosemarnews perintah dewan wakil rakyat dewan wakil rakyat pakat rancang undang undang rancang undang undang omnibus law cipta kerja rancang undang undang bawa,1
347,@callme_aiie,RUU Cipta Kerja menjamin petani sejahtera #OmnibusLawPetaniSejahtera,rancang undang undang cipta kerja jamin tani sejahtera,1
348,@ridho_maestro,"Membalas 
@PieterSoukotta5
 @kokoprianto1
  dan 2 lainnyaKan jelas tuntutan buruh batalkan RUU cipta kerja. jadi yg anda  koment dari tdi apa?",balas tuntut buruh batal rancang undang undang cipta kerja komentar,1
349,@faisaldgooners,"Membalas 
@Sarjono7070
 dan 
@hotmanParisOm nya mulai ngawur lg nih, postingan pertama dihapus malah diulang lagi. Ini kan pak Hotman Paris lagi bahas RUU Pertanahan, bukan UU Omnibus Law Cipta Kerja.",balas ngawur posting hapus ulang hotman paris bahas rancang undang undang tanah undang undang omnibus law cipta kerja,0
350,@Dee_01984,"Setelah melalui tahapan2 sebelum nya,Badan Legalisasi (Baleg) 
@DPR_RI
,
@DPDRI
 dan pemerintah melakukan rapat perdana untuk pembahasan RUU Cipta Kerja pada tanggal 14 April 2020.dan dalam rapat tersebut,Panitia Kerja (Panja)RUU Cipta Kerja resmi dibentuk.
#OmnibusLawTaatProsedural",badan legalisasi baleg perintah rapat perdana bahas rancang undang undang cipta kerja tanggal april rapat panitia kerja panitia kerja rancang undang undang cipta kerja resmi bentuk,1
351,@Dee_01984,"Sebagai salah satu Anggota Paniti Kerja RUU Omnibuslaw Cipta Kerja...
@na_nurularifin
 menegaskan bahwa tidak benar pembahasan RUU Cipta Kerja ini tidak Transparan & juga tidak dilakukan diruang gelap.

“Dikira gak mampu bayar listrik x yaa gelap gelapan 
”

#OmnibusLawTransparan",salah anggota panitia kerja rancang undang undang omnibus law cipta kerja bahas rancang undang undang cipta kerja transparan ruang gelap bayar listrik x ya gelap gelap,1
352,@Gond_rong,"[3]

Nah setelah itu disampaikan ke Presiden. 

Tepatnya tanggal 15 Januari 2020 untuk dilakukan finalisasi RUU Omnibus Law Cipta Kerja.

#OmnibusLawTaatProsedural",presiden tepat tanggal januari final rancang undang undang omnibus law cipta kerja,1
353,@1013mfmlive,"Waalaupun pejuang cuan lagi sebel sama RUU Cipta Kerja. Ya tapi kita harus tetep kerja ya Mpeople !! kira-kira nih, hal pertama apasih yang bikin kamu nyaman sama pekerjaanmu Mpeople???

#SIKATPAGIGAJI
42,9%
PARTNER KERJA
57,1%
FASILITAS KANTOR
0%
KANTOR DEKET RUMAH
0%
7 suara · Hasil akhir",juang untung sebal rancang undang undang cipta kerja ya kerja ya orang bikin nyaman kerja orang partner kerja fasilitas kantor kantor rumah suara hasil,1
354,@setankesayangan,"Membalas 
@deCasablancaaIkutan demo RUU Cipta Kerja juga ya ",balas demo rancang undang undang cipta kerja ya,1
355,@kuukaakaa44,Lihat nih pembahasan RUU Cipta Kerja ini sudah dilakukan berapa kali  #OmnibusLawTransparan,lihat bahas rancang undang undang cipta kerja kali,1
356,@SarwoHadi_P,"Ini 10 Kesimpulan Hasil Kajian Komnas HAM atas RUU Cipta Kerja
Klik untuk baca:Ini 10 Kesimpulan Hasil Kajian Komnas HAM atas RUU Cipta Kerja
Komnas HAM juga merekomendasikan penghentian pembahasan omnibus law Rancangan Undang-Undang (RUU) Cipta Kerja.
nasional.kompas.com",simpul hasil kaji komnas hak asai manusia rancang undang undang cipta kerja klik baca simpul hasil kaji komnas hak asai manusia rancang undang undang cipta kerja komnas hak asai manusia rekomendasi henti bahas omnibus law rancang undang undang rancang undang undang cipta kerja nasional,1
