id,title,title_detail,img,title_ori,title_jpn,skor,produser,tipe,status,total_eps,durasi,tgl_rilis,studio,genre,data_sinopsis,data_eps
anime298,Girly Air Force,Girly Air Force (Episode 1 – 12) Subtitle Indonesia,https://i0.wp.com/otakudesu.moe/wp-content/uploads/2019/01/Girly-Air-Force-Sub-Indo.jpg, Girly Air Force, ガーリー・エアフォース, 6.49, -, TV, Completed, 12, 23 Menit," Jan 10, 2019", Satelight," ction, Sci-Fi","Berawal dari kedatangan makhluk bernama Zai yang tiba-tiba datang menyerang bumi. Untuk melawan mereka, manusia menciptakan pesawat tempur yang diberi nama “Daughters” sekaligus mekanisme tempur otomatisnya yang bernama “Anima” yang menjadi kunci untuk memenangkan pertempuran melawan Zai.Anima merupakan robot automata yang berbentuk menyerupai sesosok gadis manusia. Dan salah satu kartu andalan dari umat manusia yaitu seorang anima bernama Gripen. Serta seorang pria bernama Kei Narutani yang terlibat bersama Gripen.Dari sinilah cerita dimulai…","[('Girly Air Force Episode 12 (End) Subtitle Indonesia', 'https://otakudesu.moe/gyaf-episode-12-sub-indo/', '17 Agustus,2019', 'https://desustream.me/playdesu/v2/?id=YmFTbklLaFJ1aGhSYVVRTUpCNXFML2h4RDNvYk5VNno2RUNwN3BWWDNaRT0='), ('Girly Air Force Episode 11 Subtitle Indonesia', 'https://otakudesu.moe/gyaf-episode-11-sub-indo/', '17 Agustus,2019', 'https://desustream.me/playdesu/v2/?id=YmFTbklLaFJ1aGhSYVVRTUpCNXFMd1FUeXc4NTNlSjNGbnpERGljWGRRUT0='), ('Girly Air Force Episode 10 Subtitle Indonesia', 'https://otakudesu.moe/gyaf-episode-10-sub-indo/', '17 Agustus,2019', 'https://desustream.me/playdesu/v2/?id=YmFTbklLaFJ1aGhSYVVRTUpCNXFMN3pJMDJqbFlKRWtOUWVDejVFcnRGST0='), ('Girly Air Force Episode 9 Subtitle Indonesia', 'https://otakudesu.moe/gyaf-episode-9-sub-indo/', '17 Agustus,2019', 'https://desustream.me/playdesu/v2/?id=YmFTbklLaFJ1aGhSYVVRTUpCNXFMK3Y2MnBEZE1CdUdyODBnSWY3bHVVND0='), ('Girly Air Force Episode 8 Subtitle Indonesia', 'https://otakudesu.moe/gyaf-episode-8-sub-indo/', '17 Agustus,2019', 'https://desustream.me/playdesu/v2/?id=YmFTbklLaFJ1aGhSYVVRTUpCNXFMeGI2L0xjZDg5cFp6OEp0TVUyalJkYz0='), ('Girly Air Force Episode 7 Subtitle Indonesia', 'https://otakudesu.moe/gyaf-episode-7-sub-indo/', '17 Agustus,2019', 'https://desustream.me/playdesu/v2/?id=YmFTbklLaFJ1aGhSYVVRTUpCNXFMNk51bTI0QzdjR04zSm9LRFJId1dyND0='), ('Girly Air Force Episode 6 Subtitle Indonesia', 'https://otakudesu.moe/gyaf-episode-6-sub-indo/', '17 Agustus,2019', 'https://desustream.me/playdesu/v2/?id=YmFTbklLaFJ1aGhSYVVRTUpCNXFMOXdKNno0b3UrWHF4ZzlpTzk2RC8xMD0='), ('Girly Air Force Episode 5 Subtitle Indonesia', 'https://otakudesu.moe/gyaf-episode-5-sub-indo/', '17 Agustus,2019', 'https://desustream.me/playdesu/v2/?id=YmFTbklLaFJ1aGhSYVVRTUpCNXFMelhVM3Y2NkJjK2hJaW5kdERTMVJjWT0='), ('Girly Air Force Episode 4 Subtitle Indonesia', 'https://otakudesu.moe/gyaf-episode-4-sub-indo/', '17 Agustus,2019', 'https://desustream.me/playdesu/v2/?id=YmFTbklLaFJ1aGhSYVVRTUpCNXFMODR5Z3p1Tm9rckdWSy93NWo2b2F6UT0='), ('Girly Air Force Episode 3 Subtitle Indonesia', 'https://otakudesu.moe/gyaf-episode-3-sub-indo/', '17 Agustus,2019', 'https://desustream.me/playdesu/v2/?id=YmFTbklLaFJ1aGhSYVVRTUpCNXFMNjRaM2JQMnBqeGt0M2grdjRDS2Yzcz0='), ('Girly Air Force Episode 2 Subtitle Indonesia', 'https://otakudesu.moe/gyaf-episode-2-sub-indo/', '17 Agustus,2019', 'https://desustream.me/playdesu/v2/?id=YmFTbklLaFJ1aGhSYVVRTUpCNXFMOWRCSjFuUUV3UU1lVWdDWW10cjllcz0='), ('Girly Air Force Episode 1 Subtitle Indonesia', 'https://otakudesu.moe/gyaf-episode-1-sub-indo/', '17 Agustus,2019', 'https://desustream.me/playdesu/v2/?id=YmFTbklLaFJ1aGhSYVVRTUpCNXFMMUdabDNxRjl1a0R4ZUtRTVJ1bEQ1WT0=')]"
anime299,GJ-bu,GJ-bu BD (Episode 1 – 12) Subtitle Indonesia,https://i0.wp.com/otakudesu.moe/wp-content/uploads/2018/01/GJ-bu-Sub-Indo.jpg, GJ-bu, GJ部, 7.44," VAP, DAX Production, Nippon Television Network", BD, Completed, 12, 23 Menit / Episode," Jan 10, 2013 sampai Mar 28, 2013", Doga Kobo," Comedy, School, Slice of Life","Bercerita tentang Good Job Klub, dengan para anggotanya yaitu.Bernstein Kirara, Sumeragi Shion, Amatsuka Megumi, Amatsuka Mao, Shinomiya Kyouya dan anggota baru mereka yaitu Kannazuki Tamaki.Disinilah cerita mereka bersama dengan aktivitas Klub yang tak memiliki tujuan atau bisa dibilang Gak Jelas dan kerjaannya cuman bermain-main setiap harinya dimulai.","[('GJ-bu Episode 12 (End) Subtitle Indonesia', 'https://otakudesu.moe/bgjuu-episode-12-sub-indo/', '1 Juli,2019', 'https://desustream.me/playdesu/v2/?id=Qk12eVpLQ01xblZGU2lXWWFBMjhsQT09'), ('GJ-bu Episode 11 Subtitle Indonesia', 'https://otakudesu.moe/bgjuu-episode-11-sub-indo/', '1 Juli,2019', 'https://desustream.me/playdesu/v2/?id=MXltNjR5b2M0T2VSaFhtZ3Bib2MrZz09'), ('GJ-bu Episode 10 Subtitle Indonesia', 'https://otakudesu.moe/bgjuu-episode-10-sub-indo/', '1 Juli,2019', 'https://desustream.me/playdesu/v2/?id=T0p6Vi92ZHJwQ3MwQWZ4NTM5YTVGZz09'), ('GJ-bu Episode 9 Subtitle Indonesia', 'https://otakudesu.moe/bgjuu-episode-9-sub-indo/', '1 Juli,2019', 'https://desustream.me/playdesu/v2/?id=Mm9ZWC85SWtCRkhJT2lsYnJERTZqQT09'), ('GJ-bu Episode 8 Subtitle Indonesia', 'https://otakudesu.moe/bgjuu-episode-8-sub-indo/', '1 Juli,2019', 'https://desustream.me/playdesu/v2/?id=QjIrVURpQ0FuQytwV3VLNG1XaHp1Zz09'), ('GJ-bu Episode 7 Subtitle Indonesia', 'https://otakudesu.moe/bgjuu-episode-7-sub-indo/', '1 Juli,2019', 'https://desustream.me/playdesu/v2/?id=SlNjSTluWG5MNWJpNHM1RERJUnBqZz09'), ('GJ-bu Episode 6 Subtitle Indonesia', 'https://otakudesu.moe/bgjuu-episode-6-sub-indo/', '1 Juli,2019', 'https://desustream.me/playdesu/v2/?id=cU9UYytabGk5MDVQTEkyczROSjJ2dz09'), ('GJ-bu Episode 5 Subtitle Indonesia', 'https://otakudesu.moe/bgjuu-episode-5-sub-indo/', '1 Juli,2019', 'https://desustream.me/playdesu/v2/?id=ZzBqRHdvU2F5NXZKTE1rMGhJOWkxZz09'), ('GJ-bu Episode 4 Subtitle Indonesia', 'https://otakudesu.moe/bgjuu-episode-4-sub-indo/', '1 Juli,2019', 'https://desustream.me/playdesu/v2/?id=S2s2MEN5cW9ySTQ0ODl1Z05GU3hkUT09'), ('GJ-bu Episode 3 Subtitle Indonesia', 'https://otakudesu.moe/bgjuu-episode-3-sub-indo/', '1 Juli,2019', 'https://desustream.me/playdesu/v2/?id=bkdVNWJMZE5vVUVJZENrQ1Q3Wkl2dz09'), ('GJ-bu Episode 2 Subtitle Indonesia', 'https://otakudesu.moe/bgjuu-episode-2-sub-indo/', '1 Juli,2019', 'https://desustream.me/playdesu/v2/?id=UStNV0ZSM0xuN0FjZlRzQkZjTkFxUT09'), ('GJ-bu Episode 1 Subtitle Indonesia', 'https://otakudesu.moe/bgjuu-episode-1-sub-indo/', '1 Juli,2019', 'https://desustream.me/playdesu/v2/?id=RENoaGJQeHJtYXpWM3JleTUzQ21mUT09')]"
anime300,Gleipnir,Gleipnir (Episode 1 – 13) Subtitle Indonesia,https://i0.wp.com/otakudesu.moe/wp-content/uploads/2020/04/Gleipnir-Sub-Indo.jpg, Gleipnir, グレイプニル, 7.09," Kodansha, bilibili, Good Smile Film", TV, Completed, 13, 23 Menit," Apr 5, 2020", Pine Jam," Action, , Mystery, Seinen, Supernatural","Shuuichi Kagaya terlihat seperti remaja pada umumnya, ia pintar dalam pelajaran dan memiliki banyak teman. Namun tak ada yang menyadari bahwa Shuuichi merupakan seorang monster.Suatu hari dirinya terbangun dengan tubuh yang besar berbulu, cakar yang tajam serta penciuman yang kuat, bahkan mulai timbul sifat kebencian yang menghilangkan sisi kemanusiaannya. Namun dirinya terlalu naif, ia berusaha untuk tidak menggunakan kekuatan tersebut dan menjadi remaja normal. Tapi ketika ia bertemu dengan Kurea Aoki, seorang gadis yang ia selamatkan saat hendak bunuh diri, Shuuichi terpaksa harus menuruti semua keinginan Kurea karena hanya ia yang mengetahui rahasia Shuuichi.Kurea sejak dulu bertekad untuk mencari monster seperti Shuuichi, ia ingin mengungkap misteri terhadap mereka serta koin emas yang telah lama ia simpan. Ya, bukan hanya Shuuichi sendiri yang memiliki kekuatan mengerikan tersebut, masih banyak orang-orang misterius bergentayangan di luar sana yang memiliki tujuannya masing-masing.","[('Gleipnir Episode 13 (End) Subtitle Indonesia', 'https://otakudesu.moe/glprn-episode-13-sub-indo/', '30 Juni,2020', 'https://desustream.me/otakuplay/v2/?id=RFJibGNWTmdtek9aMzlNVDVISkhSMERLUm5SUjlaZzF4ekYrV1kyY21IOD0='), ('Gleipnir Episode 12 Subtitle Indonesia', 'https://otakudesu.moe/glprn-episode-12-sub-indo/', '30 Juni,2020', 'https://desustream.me/otakuplay/v2/?id=RFJibGNWTmdtek9aMzlNVDVISkhSMnVsREE5WkhGRDI2Yi96T3huYThsWT0='), ('Gleipnir Episode 11 Subtitle Indonesia', 'https://otakudesu.moe/glprn-episode-11-sub-indo/', '30 Juni,2020', 'https://desustream.me/otakuplay/v2/?id=RFJibGNWTmdtek9aMzlNVDVISkhSL0lYN1g4RG5FZUs5MWx0ZjF2YXFHQT0='), ('Gleipnir Episode 10 Subtitle Indonesia', 'https://otakudesu.moe/glprn-episode-10-sub-indo/', '30 Juni,2020', 'https://desustream.me/otakuplay/v2/?id=RFJibGNWTmdtek9aMzlNVDVISkhSMXdvSXdMdkFrdkFtVGxtcHlFSjdKcz0='), ('Gleipnir Episode 9 Subtitle Indonesia', 'https://otakudesu.moe/glprn-episode-9-sub-indo/', '30 Juni,2020', 'https://desustream.me/otakuplay/v2/?id=RFJibGNWTmdtek9aMzlNVDVISkhSNzVBenN5N3BiTEpiK25wMWFaZlBtST0='), ('Gleipnir Episode 8 Subtitle Indonesia', 'https://otakudesu.moe/glprn-episode-8-sub-indo/', '30 Juni,2020', 'https://desustream.me/otakuplay/v2/?id=RFJibGNWTmdtek9aMzlNVDVISkhSMGp6YkpvK05CYnl3MWFsK3IxeXEwaz0='), ('Gleipnir Episode 7 Subtitle Indonesia', 'https://otakudesu.moe/glprn-episode-7-sub-indo/', '30 Juni,2020', 'https://desustream.me/otakuplay/v2/?id=RFJibGNWTmdtek9aMzlNVDVISkhSM25RbWUvdjU0TDJxK3JvVmpGS0dRcz0='), ('Gleipnir Episode 6 Subtitle Indonesia', 'https://otakudesu.moe/glprn-episode-6-sub-indo/', '30 Juni,2020', 'https://desustream.me/otakuplay/v2/?id=RFJibGNWTmdtek9aMzlNVDVISkhSOWFCb3BNZERaV3RlN1J3alRieiswcz0='), ('Gleipnir Episode 5 Subtitle Indonesia', 'https://otakudesu.moe/glprn-episode-5-sub-indo/', '30 Juni,2020', 'https://desustream.me/otakuplay/v2/?id=RFJibGNWTmdtek9aMzlNVDVISkhSMzhmZTZzblNnQnl0R3hmWW1LeWFIWT0='), ('Gleipnir Episode 4 Subtitle Indonesia', 'https://otakudesu.moe/glprn-episode-4-sub-indo/', '30 Juni,2020', 'https://desustream.me/otakuplay/v2/?id=RFJibGNWTmdtek9aMzlNVDVISkhSOW9RQlp5Z3FKa2hhMVZYQ1Q4TUdJbz0='), ('Gleipnir Episode 3 Subtitle Indonesia', 'https://otakudesu.moe/glprn-episode-3-sub-indo/', '30 Juni,2020', 'https://desustream.me/otakuplay/v2/?id=RFJibGNWTmdtek9aMzlNVDVISkhSNkxiOEt6SDdNajJwRlJMWUNHZHhhRT0='), ('Gleipnir Episode 2 Subtitle Indonesia', 'https://otakudesu.moe/glprn-episode-2-sub-indo/', '30 Juni,2020', 'https://desustream.me/otakuplay/v2/?id=RFJibGNWTmdtek9aMzlNVDVISkhSNjQ5SGhpVEovNTEwbE5WU2JXSHN5QT0='), ('Gleipnir Episode 1 Subtitle Indonesia', 'https://otakudesu.moe/glprn-episode-1-sub-indo/', '30 Juni,2020', 'https://desustream.me/otakuplay/v2/?id=RFJibGNWTmdtek9aMzlNVDVISkhSd0JLTTlaZUV2ZzJCUnB4aDdrM3VHMD0=')]"
anime301,Goblin Slayer,Goblin Slayer (Episode 1 – 12) Subtitle Indonesia,https://i0.wp.com/otakudesu.moe/wp-content/uploads/2018/09/Goblin-Slayer-Sub-Indo.jpg, Goblin Slayer, ゴブリンスレイヤー, 7.74," Sony Pictures Entertainment, Frontier Works, AT-X, SoftBank Creative, Bushiroad, Hakuhodo DY Music & Pictures, Good Smile Film, Artist Management Office", TV, Completed, 12, 23 Menit," Oct 7, 2018", White Fox," Action, Fantasy","Cerita berawal disaat seorang pendeta wanita muda baru saja membentuk sebuah kelompok petualang pertamanya, namun saat berpetualang, mereka mendapatkan masalah serius hingga akhirnya mereka semua terpojok.Disaat kondisi kritis, tiba-tiba mereka ditolong oleh seorang Goblin Slayer, seorang misterius yang tidak diketahui asal-usulnya, hidupnya didedikasikan hanya untuk membasmi semua goblin yang ada di muka bumi ini. Kabar angin sepak terjangnya didengar, namun tak ada satupun dari semua orang yang tahu siapa ia sebenarnya.Hingga akhirnya Goblin Slayer membentuk sebuah party baru bersama dengan rekannya yang lain. Dari sinilah cerita mencekam mereka dimulai.","[('Goblin Slayer Episode 12 (End) Subtitle Indonesia', 'https://otakudesu.moe/gobslay-episode-12-sub-indo/', '30 Desember,2018', 'https://desustream.me/playdesu/v2/?id=c2xCSEcrWTVFTXJNclQrVGx0aFpqVHJ0S3hlWS93WHpnL003S2FXQmxWOD0='), ('Goblin Slayer Episode 11 Subtitle Indonesia', 'https://otakudesu.moe/gobslay-episode-11-sub-indo/', '23 Desember,2018', 'https://desustream.me/playdesu/v2/?id=c2xCSEcrWTVFTXJNclQrVGx0aFpqUlBsNFpJQnhXcW9CVjlDQTJOaml1cz0='), ('Goblin Slayer Episode 10 Subtitle Indonesia', 'https://otakudesu.moe/gobslay-episode-10-sub-indo/', '9 Desember,2018', 'https://desustream.me/playdesu/v2/?id=c2xCSEcrWTVFTXJNclQrVGx0aFpqWWJxOFQyV0hLMkUzSWg2bjRzMjFTbz0='), ('Goblin Slayer Episode 9 Subtitle Indonesia', 'https://otakudesu.moe/gobslay-episode-9-sub-indo/', '2 Desember,2018', 'https://desustream.me/playdesu/v2/?id=c2xCSEcrWTVFTXJNclQrVGx0aFpqZkJCc1d2WDlhYy9iYUJRcml6MGZycz0='), ('Goblin Slayer Episode 8 Subtitle Indonesia', 'https://otakudesu.moe/gobslay-episode-8-sub-indo/', '24 November,2018', 'https://desustream.me/playdesu/v2/?id=c2xCSEcrWTVFTXJNclQrVGx0aFpqZGQ0MGlKU3V1dnNHR3NYZlJ4YmZ2Zz0='), ('Goblin Slayer Episode 7 Subtitle Indonesia', 'https://otakudesu.moe/gobslay-episode-7-sub-indo/', '18 November,2018', 'https://desustream.me/playdesu/v2/?id=c2xCSEcrWTVFTXJNclQrVGx0aFpqUjNzSm1JVVBYNnZiSGlLNEZlVktmbz0='), ('Goblin Slayer Episode 6 Subtitle Indonesia', 'https://otakudesu.moe/gobslay-episode-6-sub-indo/', '11 November,2018', 'https://desustream.me/playdesu/v2/?id=c2xCSEcrWTVFTXJNclQrVGx0aFpqYVJ0djZMVnhRUFFTZEpIcXlIQkJwbz0='), ('Goblin Slayer Episode 5 Subtitle Indonesia', 'https://otakudesu.moe/gobslay-episode-5-sub-indo/', '4 November,2018', 'https://desustream.me/playdesu/v2/?id=c2xCSEcrWTVFTXJNclQrVGx0aFpqVERHc044UlNRZ1ZuQXpncDdqWDJyRT0='), ('Goblin Slayer Episode 4 Subtitle Indonesia', 'https://otakudesu.moe/gobslay-episode-4-sub-indo/', '29 Oktober,2018', 'https://desustream.me/playdesu/v2/?id=c2xCSEcrWTVFTXJNclQrVGx0aFpqUnBqcUNjcVFqaHNyc3V1cEdFR0ZvND0='), ('Goblin Slayer Episode 3 Subtitle Indonesia', 'https://otakudesu.moe/gobslay-episode-3-sub-indo/', '21 Oktober,2018', 'https://desustream.me/playdesu/v2/?id=c2xCSEcrWTVFTXJNclQrVGx0aFpqVW1HSmI4N0JOU3ZLaTU3OUZpZ3crRT0='), ('Goblin Slayer Episode 2 Subtitle Indonesia', 'https://otakudesu.moe/gobslay-episode-2-sub-indo/', '13 Oktober,2018', 'https://desustream.me/playdesu/v2/?id=c2xCSEcrWTVFTXJNclQrVGx0aFpqVmlweStlZWQvMnZwUG42cHNlWFc4cz0='), ('Goblin Slayer Episode 1 Subtitle Indonesia', 'https://otakudesu.moe/gobslay-episode-1-sub-indo/', '7 Oktober,2018', 'https://desustream.me/playdesu/v2/?id=c2xCSEcrWTVFTXJNclQrVGx0aFpqU01ocHMzOXhKWmovSE1xK1NzNlV5bz0=')]"
anime302,Gochuumon wa Usagi desu ka?,Gochuumon wa Usagi desu ka? BD (Episode 1 – 12) Subtitle Indonesia,https://i0.wp.com/otakudesu.moe/wp-content/uploads/2018/08/Gochuumon-wa-Usagi-desu-ka-Sub-Indo.jpg, Gochuumon wa Usagi desu ka?, ご注文はうさぎですか？, 7.60," Frontier Works, Sotsu, Magic Capsule, Showgate, Houbunsha, NBCUniversal Entertainment Japan, RAY", BD, Completed, 12, 23 Menit / Episode," Apr 10, 2014 sampai Jun 26, 2014", White Fox," Comedy, Slice of Life","Berawal saat Hoto Kokoa, seorang gadis yang lucu dan semangat itu pindah ke tempat tinggal barunya karena ingin bersekolah ditempat lain, Cocoa kini tinggal disebuah rumah sekaligus cafe yang bernama Rabbit House. Untuk membalas budi karena ia diperbolehkan tinggal disana Cocoa kini menjadi seorang pekerja di cafe tersebut.Meski pada awalnya ia tak mengerti dengan hidangan seperti kopi dan hal-hal lainnya, namun disana ia tetap bahagia dan bersemangat untuk menjalani kehidupan barunya, ia sama-sama bekerja dengan anak dari pemiliki cafe tersebut, Kafuu Chino, serta Tedeza Rize yang juga pekerja paruh waktu disana.Cocoa juga bertemu dengan teman-teman barunya Kirima Sharo & Ujimatsu Chiya yang merupakan saingan mereka yang berasal dari cafe lain. Dari sinilah kehidupan baru Cocoa sebagai Maid dimulai.Tonton juga Season Selanjutnya disini, Gochuumon wa Usagi desu ka?? (Season 2).","[('Gochuumon wa Usagi desu ka? Episode 12 (End) Subtitle Indonesia', 'https://otakudesu.moe/gocudesk-episode-12-sub-indo/', '10 Agustus,2018', 'https://desustream.me/playdesu/v2/?id=NGVxSE9tWU9KbmdjelRUK1lQWWRTWUI1ekpkRUZOZ0orRHN5SWlvTThNbz0='), ('Gochuumon wa Usagi desu ka? Episode 11 Subtitle Indonesia', 'https://otakudesu.moe/gocudesk-episode-11-sub-indo/', '10 Agustus,2018', 'https://desustream.me/playdesu/v2/?id=NGVxSE9tWU9KbmdjelRUK1lQWWRTYWpTdWFGNzk4TGdmb3pxNUErSHZyRT0='), ('Gochuumon wa Usagi desu ka? Episode 10 Subtitle Indonesia', 'https://otakudesu.moe/gocudesk-episode-10-sub-indo/', '10 Agustus,2018', 'https://desustream.me/playdesu/v2/?id=NGVxSE9tWU9KbmdjelRUK1lQWWRTZmtFNytCS0tTUTMxZ0dnODFqK2Vhbz0='), ('Gochuumon wa Usagi desu ka? Episode 9 Subtitle Indonesia', 'https://otakudesu.moe/gocudesk-episode-9-sub-indo/', '10 Agustus,2018', 'https://desustream.me/playdesu/v2/?id=NGVxSE9tWU9KbmdjelRUK1lQWWRTUTM2c0xPd0VCME9aYXo0MmRCM3FlOD0='), ('Gochuumon wa Usagi desu ka? Episode 8 Subtitle Indonesia', 'https://otakudesu.moe/gocudesk-episode-8-sub-indo/', '10 Agustus,2018', 'https://desustream.me/playdesu/v2/?id=NGVxSE9tWU9KbmdjelRUK1lQWWRTZlN3dVNmb0lIV3RSUTVycEgxbE45ND0='), ('Gochuumon wa Usagi desu ka? Episode 7 Subtitle Indonesia', 'https://otakudesu.moe/gocudesk-episode-7-sub-indo/', '10 Agustus,2018', 'https://desustream.me/playdesu/v2/?id=NGVxSE9tWU9KbmdjelRUK1lQWWRTVDZWbFpPM2ltTG84T1RyN3ZSZG9Qcz0='), ('Gochuumon wa Usagi desu ka? Episode 6 Subtitle Indonesia', 'https://otakudesu.moe/gocudesk-episode-6-sub-indo/', '10 Agustus,2018', 'https://desustream.me/playdesu/v2/?id=NGVxSE9tWU9KbmdjelRUK1lQWWRTYi9IZWRYNjYwT282bGhMMjVCUU1Sbz0='), ('Gochuumon wa Usagi desu ka? Episode 5 Subtitle Indonesia', 'https://otakudesu.moe/gocudesk-episode-5-sub-indo/', '10 Agustus,2018', 'https://desustream.me/playdesu/v2/?id=NGVxSE9tWU9KbmdjelRUK1lQWWRTUWhlTTN4eU5oTXJEa2FITzg2KzlLWT0='), ('Gochuumon wa Usagi desu ka? Episode 4 Subtitle Indonesia', 'https://otakudesu.moe/gocudesk-episode-4-sub-indo/', '10 Agustus,2018', 'https://desustream.me/playdesu/v2/?id=NGVxSE9tWU9KbmdjelRUK1lQWWRTVkFHZWNnOHZsV2V6QysvL3U3QjhUaz0='), ('Gochuumon wa Usagi desu ka? Episode 3 Subtitle Indonesia', 'https://otakudesu.moe/gocudesk-episode-3-sub-indo/', '10 Agustus,2018', 'https://desustream.me/playdesu/v2/?id=NGVxSE9tWU9KbmdjelRUK1lQWWRTZGczUXFFdW9rbTBlMXJxeExGbDVUaz0='), ('Gochuumon wa Usagi desu ka? Episode 2 Subtitle Indonesia', 'https://otakudesu.moe/gocudesk-episode-2-sub-indo/', '10 Agustus,2018', 'https://desustream.me/playdesu/v2/?id=NGVxSE9tWU9KbmdjelRUK1lQWWRTUS9PbllZNUZ3aXZVRW1mMElXQWhwcz0='), ('Gochuumon wa Usagi desu ka? Episode 1 Subtitle Indonesia', 'https://otakudesu.moe/gocudesk-episode-1-sub-indo/', '10 Agustus,2018', 'https://desustream.me/playdesu/v2/?id=NGVxSE9tWU9KbmdjelRUK1lQWWRTY0pMeUh0ZFZFUEtKcmY3R1l6aTZwRT0=')]"
anime303,Gochuumon wa Usagi desu ka? Season 2,Gochuumon wa Usagi desu ka? S2 BD (Episode 1 – 12) Subtitle Indonesia,https://i0.wp.com/otakudesu.moe/wp-content/uploads/2018/08/Gochuumon-wa-Usagi-desu-ka-Season-2-Sub-Indo.jpg, Gochuumon wa Usagi desu ka? Season 2, ご注文はうさぎですか？？, 7.94," Frontier Works, AT-X, Magic Capsule, Bushiroad, Showgate, Houbunsha, NBCUniversal Entertainment Japan, i0+, Hakuhodo DY Music & Pictures, RAY", BD, Completed, 12, 23 Menit / Episode," Oct 10, 2015 sampai Dec 26, 2015"," Kinema Citrus, White Fox"," Comedy, Slice of Life","Season ke-2 dari Gochuumon wa Usagi desu ka?. Masih menceritakan Hoto Kokoa yang bekerja di cafe sebagai seorang pelayan (maid).Disinilah cerita mereka Kafuu Chino, Tedeza Rize, Hoto Kokoa, Kirima Sharo, Ujimatsu Chiya kembali menemani kalian di seri ini.","[('Gochuumon wa Usagi desu ka? S2 Episode 12 (End) Subtitle Indonesia', 'https://otakudesu.moe/gocudesk-season-2-episode-12-sub-indo/', '10 Agustus,2018', 'https://desustream.me/playdesu/v2/?id=NGVxSE9tWU9KbmdjelRUK1lQWWRTYUs0Q3E2azFWQzJCRk1jOXJiUzc2ND0='), ('Gochuumon wa Usagi desu ka? S2 Episode 11 Subtitle Indonesia', 'https://otakudesu.moe/gocudesk-season-2-episode-11-sub-indo/', '10 Agustus,2018', 'https://desustream.me/playdesu/v2/?id=NGVxSE9tWU9KbmdjelRUK1lQWWRTWTRTN0kwb1N0VWs3T3paY2ZFYWU5UT0='), ('Gochuumon wa Usagi desu ka? S2 Episode 10 Subtitle Indonesia', 'https://otakudesu.moe/gocudesk-season-2-episode-10-sub-indo/', '10 Agustus,2018', 'https://desustream.me/playdesu/v2/?id=NGVxSE9tWU9KbmdjelRUK1lQWWRTYityMEhSaXQwMnJVQzRtZWc0azR1RT0='), ('Gochuumon wa Usagi desu ka? S2 Episode 9 Subtitle Indonesia', 'https://otakudesu.moe/gocudesk-season-2-episode-9-sub-indo/', '10 Agustus,2018', 'https://desustream.me/playdesu/v2/?id=NGVxSE9tWU9KbmdjelRUK1lQWWRTY1h0TmNYMmNNME9OT016ZlRCU1AvWT0='), ('Gochuumon wa Usagi desu ka? S2 Episode 8 Subtitle Indonesia', 'https://otakudesu.moe/gocudesk-season-2-episode-8-sub-indo/', '10 Agustus,2018', 'https://desustream.me/playdesu/v2/?id=NGVxSE9tWU9KbmdjelRUK1lQWWRTVmU5N05QdTR1VjlDeUYvdDUzM0dobz0='), ('Gochuumon wa Usagi desu ka? S2 Episode 7 Subtitle Indonesia', 'https://otakudesu.moe/gocudesk-season-2-episode-7-sub-indo/', '10 Agustus,2018', 'https://desustream.me/playdesu/v2/?id=NGVxSE9tWU9KbmdjelRUK1lQWWRTY00yNFFtbFEyZGppUGJVSWJJUkkxYz0='), ('Gochuumon wa Usagi desu ka? S2 Episode 6 Subtitle Indonesia', 'https://otakudesu.moe/gocudesk-season-2-episode-6-sub-indo/', '10 Agustus,2018', 'https://desustream.me/playdesu/v2/?id=NGVxSE9tWU9KbmdjelRUK1lQWWRTYklDL2RBVWQ0KzN1QXpUUnNoejY2OD0='), ('Gochuumon wa Usagi desu ka? S2 Episode 5 Subtitle Indonesia', 'https://otakudesu.moe/gocudesk-season-2-episode-5-sub-indo/', '10 Agustus,2018', 'https://desustream.me/playdesu/v2/?id=NGVxSE9tWU9KbmdjelRUK1lQWWRTY2x5QXFBajJYaUUzbkNQalhNYzYrYz0='), ('Gochuumon wa Usagi desu ka? S2 Episode 4 Subtitle Indonesia', 'https://otakudesu.moe/gocudesk-season-2-episode-4-sub-indo/', '10 Agustus,2018', 'https://desustream.me/playdesu/v2/?id=NGVxSE9tWU9KbmdjelRUK1lQWWRTYTdPVURFdkJoeklCOFpyd2RyT3Qyaz0='), ('Gochuumon wa Usagi desu ka? S2 Episode 3 Subtitle Indonesia', 'https://otakudesu.moe/gocudesk-season-2-episode-3-sub-indo/', '10 Agustus,2018', 'https://desustream.me/playdesu/v2/?id=NGVxSE9tWU9KbmdjelRUK1lQWWRTUUxoUDc0ZlFLYWRWTzFxVWhtVkRGcz0='), ('Gochuumon wa Usagi desu ka? S2 Episode 2 Subtitle Indonesia', 'https://otakudesu.moe/gocudesk-season-2-episode-2-sub-indo/', '10 Agustus,2018', 'https://desustream.me/playdesu/v2/?id=NGVxSE9tWU9KbmdjelRUK1lQWWRTVm90SFZ1NWkrZDQvWmhOSTBRK3pjTT0='), ('Gochuumon wa Usagi desu ka? S2 Episode 1 Subtitle Indonesia', 'https://otakudesu.moe/gocudesk-season-2-episode-1-sub-indo/', '10 Agustus,2018', 'https://desustream.me/playdesu/v2/?id=NGVxSE9tWU9KbmdjelRUK1lQWWRTWm9YQnFjUi9hVFNaaS9GREJmSFRyND0=')]"
anime304,Gochuumon wa Usagi Desu ka? Season 3,Gochuumon wa Usagi Desu ka? S3 (Episode 1 – 12) Subtitle Indonesia,https://i0.wp.com/otakudesu.moe/wp-content/uploads/2020/10/Gochuumon-wa-Usagi-Desu-ka-Season-3-Sub-Indo.jpg, Gochuumon wa Usagi Desu ka? Season 3, ご注文はうさぎですか? BLOOM, 7.98, -, TV, Completed, 12, 24 Menit," Oct 10, 2020", Encourage Films," Comedy, Slice of Life",Season ke-3 dari anime Gochuumon wa Usagi Desu ka?.,"[('Gochuumon wa Usagi Desu ka? S3 Episode 12 (End) Subtitle Indonesia', 'https://otakudesu.moe/gocudesk-s3-episode-12-sub-indo/', '15 Januari,2021', 'https://desustream.me/otakuplay/v2/?id=RmMwcEx0VHJBMDdMT1dwbm12VlNTbDNIbjlrZDZqTkVOTU15bHFQRUtaMD0='), ('Gochuumon wa Usagi Desu ka? S3 Episode 11 Subtitle Indonesia', 'https://otakudesu.moe/gocudesk-s3-episode-11-sub-indo/', '15 Januari,2021', 'https://desustream.me/otakuplay/v2/?id=RmMwcEx0VHJBMDdMT1dwbm12VlNTanlsdVowOUtlbjY3Wml4KzZxWlZUdz0='), ('Gochuumon wa Usagi Desu ka? S3 Episode 10 Subtitle Indonesia', 'https://otakudesu.moe/gocudesk-s3-episode-10-sub-indo/', '15 Januari,2021', 'https://desustream.me/otakuplay/v2/?id=RmMwcEx0VHJBMDdMT1dwbm12VlNTajc4bm04aWRwY0ttWXdCUmIyQ0lFcz0='), ('Gochuumon wa Usagi Desu ka? S3 Episode 9 Subtitle Indonesia', 'https://otakudesu.moe/gocudesk-s3-episode-9-sub-indo/', '15 Januari,2021', 'https://desustream.me/otakuplay/v2/?id=RmMwcEx0VHJBMDdMT1dwbm12VlNTdGoxdzZCTy8zV3lVTnlMaTF0T3oxUT0='), ('Gochuumon wa Usagi Desu ka? S3 Episode 8 Subtitle Indonesia', 'https://otakudesu.moe/gocudesk-s3-episode-8-sub-indo/', '15 Januari,2021', 'https://desustream.me/otakuplay/v2/?id=RmMwcEx0VHJBMDdMT1dwbm12VlNTbFdaMGNpWFhFODhxeEZIZkhOR1FuMD0='), ('Gochuumon wa Usagi Desu ka? S3 Episode 7 Subtitle Indonesia', 'https://otakudesu.moe/gocudesk-s3-episode-7-sub-indo/', '15 Januari,2021', 'https://desustream.me/otakuplay/v2/?id=RmMwcEx0VHJBMDdMT1dwbm12VlNTck9KZE1zY3lWdUVUdlZMYXhqbExzdz0='), ('Gochuumon wa Usagi Desu ka? S3 Episode 6 Subtitle Indonesia', 'https://otakudesu.moe/gocudesk-s3-episode-6-sub-indo/', '15 Januari,2021', 'https://desustream.me/otakuplay/v2/?id=RmMwcEx0VHJBMDdMT1dwbm12VlNTb1ZjQVB5d2dZTFIxallWUjFRaFNLTT0='), ('Gochuumon wa Usagi Desu ka? S3 Episode 5 Subtitle Indonesia', 'https://otakudesu.moe/gocudesk-s3-episode-5-sub-indo/', '15 Januari,2021', 'https://desustream.me/otakuplay/v2/?id=RmMwcEx0VHJBMDdMT1dwbm12VlNTb0dnNDNZUHJBeExkNDU3TFNza0lUVT0='), ('Gochuumon wa Usagi Desu ka? S3 Episode 4 Subtitle Indonesia', 'https://otakudesu.moe/gocudesk-s3-episode-4-sub-indo/', '15 Januari,2021', 'https://desustream.me/otakuplay/v2/?id=RmMwcEx0VHJBMDdMT1dwbm12VlNTalBZeUVCSG9JY0w3cHUzWjRkSmxrWT0='), ('Gochuumon wa Usagi Desu ka? S3 Episode 3 Subtitle Indonesia', 'https://otakudesu.moe/gocudesk-s3-episode-3-sub-indo/', '15 Januari,2021', 'https://desustream.me/otakuplay/v2/?id=RmMwcEx0VHJBMDdMT1dwbm12VlNTaHZNTnhjdElXRU5xc0VVTzlpMmJEcz0='), ('Gochuumon wa Usagi Desu ka? S3 Episode 2 Subtitle Indonesia', 'https://otakudesu.moe/gocudesk-s3-episode-2-sub-indo/', '15 Januari,2021', 'https://desustream.me/otakuplay/v2/?id=RmMwcEx0VHJBMDdMT1dwbm12VlNTajUwTE9uMFdVVVRCcFYzcE5vSVdOcz0='), ('Gochuumon wa Usagi Desu ka? S3 Episode 1 Subtitle Indonesia', 'https://otakudesu.moe/gocudesk-s3-episode-1-sub-indo/', '15 Januari,2021', 'https://desustream.me/otakuplay/v2/?id=RmMwcEx0VHJBMDdMT1dwbm12VlNTa1I1WlI4b1I2L1QvN0ZUb2o3WkI1ST0=')]"
