id,title,title_detail,img,title_ori,title_jpn,skor,produser,tipe,status,total_eps,durasi,tgl_rilis,studio,genre,data_sinopsis,data_eps
anime305,God Eater,God Eater BD (Episode 1 – 13) Subtitle Indonesia,https://i0.wp.com/otakudesu.moe/wp-content/uploads/2018/04/God-Eater-Sub-Indo.jpg, God Eater, GOD EATER, 7.50," Bandai Visual, Lantis, Anime Consortium Japan", BD, Completed, 13, 23 Menit / Episode," Jul 12, 2015 sampai Mar 26, 2016", ufotable," Action, Fantasy, Military, Sci-Fi","Tahun 2071, umat manusia kini telah berada diambang kepunahan karena munculnya makhluk-makhluk mengerikan bernama “Aragami”. Aragami telah membuat bumi porak poranda bahkan telah banyak menelan korban jiwa serta menghancurkan kehidupan spesies lainnya di bumi.Aragami sangat sulit untuk dikalahkan, mereka kebal terhadap serangan dari senjata biasa hingga bom sekalipun. Untuk menanggulangi ancaman tersebut, manusia kini membentuk sebuah unit khusus yaitu “Fenrir”. Fenrir mengumpulkan korban-korban yang masih selamat dari seluruh tempat dan mengevakuasi mereka ketempat yang aman untuk mencegah kepunahan manusia.Walaupun dalam ambang kehancuran, manusia kini sedang merencanakan untuk menyerang para Aragami dengan dibentuknya pasukan khusus yang bernama “God Eater”. Dipersenjatai dengan senjata khusus God Arcs, satu-satunya senjata yang dapat melawan dan membunuh Aragami serta kekebalan tubuh para God Eater telah ditingkatkan dengan obat dan cairan tertentu yang membuat mereka lebih kuat dari manusia lainnya.Akankah manusia dapat membasmi monster-monster Aragami?","[('God Eater Episode 13 (End) Subtitle Indonesia', 'https://otakudesu.moe/gdetr-episode-13-sub-indo/', '6 Juli,2019', 'https://desustream.me/playdesu/v2/?id=NklCTW1hb085T1JkMnhZamkrTUdOSlVzT3U1WkFaYnlUQzJadHR5QzVIZz0='), ('God Eater Episode 12 Subtitle Indonesia', 'https://otakudesu.moe/gdetr-episode-12-sub-indo/', '6 Juli,2019', 'https://desustream.me/playdesu/v2/?id=NklCTW1hb085T1JkMnhZamkrTUdOS0lvOFlFckk3M1dXZlFDYUl4eFdSQT0='), ('God Eater Episode 11 Subtitle Indonesia', 'https://otakudesu.moe/gdetr-episode-11-sub-indo/', '6 Juli,2019', 'https://desustream.me/playdesu/v2/?id=NklCTW1hb085T1JkMnhZamkrTUdOQjREb3RleWxYcWZHQ2xnL0xGN1JyVT0='), ('God Eater Episode 10 Subtitle Indonesia', 'https://otakudesu.moe/gdetr-episode-10-sub-indo/', '6 Juli,2019', 'https://desustream.me/playdesu/v2/?id=NklCTW1hb085T1JkMnhZamkrTUdOQzdCeUtQOVhKbk95MkRiRStUYXdGWT0='), ('God Eater Episode 9 Subtitle Indonesia', 'https://otakudesu.moe/gdetr-episode-9-sub-indo/', '6 Juli,2019', 'https://desustream.me/playdesu/v2/?id=SnRLVFJtbWFEbytQdzA2WVJxTmtDMllEdEliRWNwWnpRaGFKL0ozMW1vUT0='), ('God Eater Episode 8 Subtitle Indonesia', 'https://otakudesu.moe/gdetr-episode-8-sub-indo/', '6 Juli,2019', 'https://desustream.me/playdesu/v2/?id=WmtWNTZwMUduRElUZVEySDcyMHdKdUI5VWVmV08yNVVQSVNscERxU1lQZz0='), ('God Eater Episode 7 Subtitle Indonesia', 'https://otakudesu.moe/gdetr-episode-7-sub-indo/', '6 Juli,2019', 'https://desustream.me/playdesu/v2/?id=SHBTcEdzNVgvZUhMZHA0M1F5K1hoRkg3NUJBRnlQSkNhYmp0eTIxN0RMWT0='), ('God Eater Episode 6 Subtitle Indonesia', 'https://otakudesu.moe/gdetr-episode-6-sub-indo/', '6 Juli,2019', 'https://desustream.me/playdesu/v2/?id=RklBa2htaUx1cTcra2RWaFJGWXNUQ292SnIzMHlORlF4VGs4SDBzeVUzaz0='), ('God Eater Episode 5 Subtitle Indonesia', 'https://otakudesu.moe/gdetr-episode-5-sub-indo/', '6 Juli,2019', 'https://desustream.me/playdesu/v2/?id=d1hGajZHSWJwOW5lR1VXS3orL3RYOWx5K0hNWFJkeHoyY21VYTRIbjNtRT0='), ('God Eater Episode 4 Subtitle Indonesia', 'https://otakudesu.moe/gdetr-episode-4-sub-indo/', '6 Juli,2019', 'https://desustream.me/playdesu/v2/?id=d05VdUEyWWdZUzl6WXdzak5OQjUwMTdzWFozb1FxVm9VWllKUUVHNnhsOD0='), ('God Eater Episode 3 Subtitle Indonesia', 'https://otakudesu.moe/gdetr-episode-3-sub-indo/', '6 Juli,2019', 'https://desustream.me/playdesu/v2/?id=eWk2NWswSkxyRTB6ZzZzOWJ5UjhQZE5QbWdZd0MvdzlDajVZcWg3MjY0VT0='), ('God Eater Episode 2 Subtitle Indonesia', 'https://otakudesu.moe/gdetr-episode-2-sub-indo/', '6 Juli,2019', 'https://desustream.me/playdesu/v2/?id=bjNqT25rWlYvVmxnc3crVGw2VnBsdW1oalJ4dTRHL3ZWdTA1R3pMMS9IWT0='), ('God Eater Episode 1 Subtitle Indonesia', 'https://otakudesu.moe/gdetr-episode-1-sub-indo/', '6 Juli,2019', 'https://desustream.me/playdesu/v2/?id=NklCTW1hb085T1JkMnhZamkrTUdOTVBUYWd4aDJJTzRnb2VyalNOOUU4QT0=')]"
anime306,Godzilla: S.P,Godzilla Singular Point (Episode 1 – 13) Subtitle Indonesia,https://i0.wp.com/otakudesu.moe/wp-content/uploads/2021/04/Godzilla-SP-Sub-Indo.jpg, Godzilla, ゴジラ S.P ＜シンギュラポイント＞, 6.75," Toho, Netflix", TV, Completed, 13, 23 Menit," Mar 25, 202"," Bones, Orange", Action,"Godzilla Singular Point mengisahkan seorang gadis  muda nan jenius bernama Mei Kamino. Kamino merupakan seorang peneliti yang mempelajari “makhluk tidak ada’. Kamino digambarkan sebagai seorang gadis ceria dan percaya diri. Selain itu, sifatnya yang suka linglung membuatnya sering kehilangan banyak hal.Dalam perjalannya, Mei ditemani oleh seorang insinyur muda bernama Yun Arikawa. Yun saat ini bekerja sebagai insinyur di Pabrik Otaki. Arikawa memiliki keterampilan dalam hal robot dan pemrograman. Namun, ia mengalami kesulitan dalam hal interaksi.Suatu hari, Mei Kamino dan Yun Arikawa terlibat dalam pertarungan Godzilla bersama dengan teman-temannya. Lantas, bagaimana cara keduanya mengatasi masalah tersebut?","[('Godzilla: S.P Episode 13 (End) Subtitle Indonesia', 'https://otakudesu.moe/gdzal-sp-episode-13-sub-indo/', '30 Juni,2021', 'https://desustream.me/moedesu/hd/?id=VldNZ3hudm5keFYvVUJ3N2NJS2M5SFA1RVEzNmdxRHpsV0U3QmxTTVJGbz0='), ('Godzilla: S.P Episode 12 Subtitle Indonesia', 'https://otakudesu.moe/gdzal-sp-episode-12-sub-indo/', '30 Juni,2021', 'https://desustream.me/moedesu/hd/?id=VldNZ3hudm5keFYvVUJ3N2NJS2M5RTJOei82Y1dMbW0zaUZkU2FTMFFtWT0='), ('Godzilla: S.P Episode 11 Subtitle Indonesia', 'https://otakudesu.moe/gdzal-sp-episode-11-sub-indo/', '30 Juni,2021', 'https://desustream.me/moedesu/hd/?id=VldNZ3hudm5keFYvVUJ3N2NJS2M5R0p0U2d1OVRMRTIvVTZtSmFRUkxaQT0='), ('Godzilla: S.P Episode 10 Subtitle Indonesia', 'https://otakudesu.moe/gdzal-sp-episode-10-sub-indo/', '30 Juni,2021', 'https://desustream.me/moedesu/hd/?id=VldNZ3hudm5keFYvVUJ3N2NJS2M5SnRmd1BNWGVTS1gyV3YxTWJEVFJwaz0='), ('Godzilla: S.P Episode 9 Subtitle Indonesia', 'https://otakudesu.moe/gdzal-sp-episode-9-sub-indo/', '30 Juni,2021', 'https://desustream.me/moedesu/hd/?id=VldNZ3hudm5keFYvVUJ3N2NJS2M5RVVBTm50ZXpwZHZieTBhU2tnRnp2RT0='), ('Godzilla: S.P Episode 8 Subtitle Indonesia', 'https://otakudesu.moe/gdzal-sp-episode-8-sub-indo/', '30 Juni,2021', 'https://desustream.me/moedesu/hd/?id=VldNZ3hudm5keFYvVUJ3N2NJS2M5Q3o3dUdBUFVGMTFFZlN6cTdweldoYz0='), ('Godzilla: S.P Episode 7 Subtitle Indonesia', 'https://otakudesu.moe/gdzal-sp-episode-7-sub-indo/', '30 Juni,2021', 'https://desustream.me/moedesu/hd/?id=VldNZ3hudm5keFYvVUJ3N2NJS2M5R0dVV0V4ZnEzZTRqUkN6ZWtnOGp6ND0='), ('Godzilla: S.P Episode 6 Subtitle Indonesia', 'https://otakudesu.moe/gdzal-sp-episode-6-sub-indo/', '30 Juni,2021', 'https://desustream.me/moedesu/hd/?id=VldNZ3hudm5keFYvVUJ3N2NJS2M5UGViaHlOYkpSdXB0cUYrVUdVdjkxST0='), ('Godzilla: S.P Episode 5 Subtitle Indonesia', 'https://otakudesu.moe/gdzal-sp-episode-5-sub-indo/', '30 Juni,2021', 'https://desustream.me/moedesu/hd/?id=VldNZ3hudm5keFYvVUJ3N2NJS2M5TXlTZi9TL1krd3NXK2NBMHgyYnowVT0='), ('Godzilla: S.P Episode 4 Subtitle Indonesia', 'https://otakudesu.moe/gdzal-sp-episode-4-sub-indo/', '30 Juni,2021', 'https://desustream.me/moedesu/hd/?id=VldNZ3hudm5keFYvVUJ3N2NJS2M5TWpUYmxUZEZTS2gyalpyQVUxb3B4QT0='), ('Godzilla: S.P Episode 3 Subtitle Indonesia', 'https://otakudesu.moe/gdzal-sp-episode-3-sub-indo/', '30 Juni,2021', 'https://desustream.me/moedesu/hd/?id=VldNZ3hudm5keFYvVUJ3N2NJS2M5SGVzRHJxV3RRRUt2akQ4dS9ycFpQUT0='), ('Godzilla: S.P Episode 2 Subtitle Indonesia', 'https://otakudesu.moe/gdzal-sp-episode-2-sub-indo/', '30 Juni,2021', 'https://desustream.me/moedesu/hd/?id=VldNZ3hudm5keFYvVUJ3N2NJS2M5Q3M1UkRRZHlKaWVqUmI4MThKcy83cz0='), ('Godzilla: S.P Episode 1 Subtitle Indonesia', 'https://otakudesu.moe/gdzal-sp-episode-1-sub-indo/', '30 Juni,2021', 'https://desustream.me/moedesu/hd/?id=VldNZ3hudm5keFYvVUJ3N2NJS2M5Tm5oK2pMdVFLdno5L08rUVkwaTBKbz0=')]"
anime307,Gokukoku no Brynhildr,Gokukoku no Brynhildr (Episode 1 – 13) Subtitle Indonesia + Special,https://i0.wp.com/otakudesu.moe/wp-content/uploads/2019/10/Gokukoku-no-Brynhildr-Sub-Indo.jpg, Gokukoku no Brynhildr, 極黒のブリュンヒルデ, 7.02, VAP, BD, Completed, 13, 23 Menit," Apr 6, 2014", Arms," Drama, Mystery, Sci-Fi, Seinen","Ryouta Murakami tak bisa melupakan masa lalunya saat sahabatnya Kuroneko meninggal saat terjatuh dari sebuah bendungan bersamanya karena sedang ingin membuktikan bahwa alien yang dipercayai oleh Kuroneko benar adanya. Hinggak kini Ryouta masih merasa bersalah, ia bahkan selalu belajar dan menjadi seorang angkasawan dan membuktikan perkataan Kuroneko bahwa alien benar-benar ada.Hingga suatu hari, seorang murid baru muncul di sekolahnya, gadis tersebut ialah Kuroha Neko, alangkah terkejutnya Ryouta melihat sesosok gadis yang sangat mirip dengan teman masa lalunya, Kuroneko. Namun sayangnya Kuroha membantah bahwa ia adalah Kuroneko seperti yang disebutkan oleh Ryouta.Masih tidak percaya, Ryouta masih penasaran akan siapa Kuroha, saat mereka bertemu di ruang klub astronomi, Kuroha memberitahukan bahwa dirinya dapat melihat masa depan dan mengakui bahwa dirinya merupakan seorang penyihir. Ryouta tak bisa membantah perkataanya ketika Kuroha benar-benar menyelamatkannya dari kematian.Dari sinilah Ryouta terseret kepada ke dunia mematikan dimana para penyihir lari dari buruan para ilmuwan berbahaya. Mereka memiliki kekuatan unik yang berbeda dari manusia biasa.","[('Gokukoku no Brynhildr Special Subtitle Indonesia', 'https://otakudesu.moe/gkk-byldr-special-sub-indo/', '18 November,2019', 'https://desustream.me/otakuplay/v2/?id=VElZdURRL285U0M2aEpxMkc3VzVwcld3Uk15K3FXZnBmck85RG00NFp0Zz0='), ('Gokukoku no Brynhildr Episode 13 (End) Subtitle Indonesia', 'https://otakudesu.moe/gkk-byldr-episode-13-sub-indo/', '18 November,2019', 'https://desustream.me/otakuplay/v2/?id=VElZdURRL285U0M2aEpxMkc3VzVwdFpKQ25uNEJ1NU9qSHplM3V1eWxsdz0='), ('Gokukoku no Brynhildr Episode 12 Subtitle Indonesia', 'https://otakudesu.moe/gkk-byldr-episode-12-sub-indo/', '18 November,2019', 'https://desustream.me/otakuplay/v2/?id=VElZdURRL285U0M2aEpxMkc3VzVwbHZCTjhYMUdHcUh3ZnV4d0x4R0J0ND0='), ('Gokukoku no Brynhildr Episode 11 Subtitle Indonesia', 'https://otakudesu.moe/gkk-byldr-episode-11-sub-indo/', '18 November,2019', 'https://desustream.me/otakuplay/v2/?id=VElZdURRL285U0M2aEpxMkc3VzVwbERaNXlKY2tGRjc5WUIySlR6MWRQdz0='), ('Gokukoku no Brynhildr Episode 10 Subtitle Indonesia', 'https://otakudesu.moe/gkk-byldr-episode-10-sub-indo/', '18 November,2019', 'https://desustream.me/otakuplay/v2/?id=VElZdURRL285U0M2aEpxMkc3VzVwbzBza2xCL0RCMXlIMjZtTEhqN2Z2Zz0='), ('Gokukoku no Brynhildr Episode 9 Subtitle Indonesia', 'https://otakudesu.moe/gkk-byldr-episode-9-sub-indo/', '18 November,2019', 'https://desustream.me/otakuplay/v2/?id=VElZdURRL285U0M2aEpxMkc3VzVwdWgxWmRrRmRMcnlDZXpmTUw4K3lFUT0='), ('Gokukoku no Brynhildr Episode 8 Subtitle Indonesia', 'https://otakudesu.moe/gkk-byldr-episode-8-sub-indo/', '18 November,2019', 'https://desustream.me/otakuplay/v2/?id=VElZdURRL285U0M2aEpxMkc3VzVwbkc1cmlGMHVoZGZnT3QxN0ozaEF0QT0='), ('Gokukoku no Brynhildr Episode 7 Subtitle Indonesia', 'https://otakudesu.moe/gkk-byldr-episode-7-sub-indo/', '18 November,2019', 'https://desustream.me/otakuplay/v2/?id=VElZdURRL285U0M2aEpxMkc3VzVwbE5KeWJmNjBFaUd4TlF0U2JhbEdSUT0='), ('Gokukoku no Brynhildr Episode 6 Subtitle Indonesia', 'https://otakudesu.moe/gkk-byldr-episode-6-sub-indo/', '18 November,2019', 'https://desustream.me/otakuplay/v2/?id=VElZdURRL285U0M2aEpxMkc3VzVwZ3c2ZlFiS3NHTVZlaFpkME9pWTVnbz0='), ('Gokukoku no Brynhildr Episode 5 Subtitle Indonesia', 'https://otakudesu.moe/gkk-byldr-episode-5-sub-indo/', '18 November,2019', 'https://desustream.me/otakuplay/v2/?id=VElZdURRL285U0M2aEpxMkc3VzVwb3VvQjQwUHBYeWZzNnd1U1l6ckZWND0='), ('Gokukoku no Brynhildr Episode 4 Subtitle Indonesia', 'https://otakudesu.moe/gkk-byldr-episode-4-sub-indo/', '18 November,2019', 'https://desustream.me/otakuplay/v2/?id=VElZdURRL285U0M2aEpxMkc3VzVwc05OUXFuNUo0Q0FvcHB5NXZDblluVT0='), ('Gokukoku no Brynhildr Episode 3 Subtitle Indonesia', 'https://otakudesu.moe/gkk-byldr-episode-3-sub-indo/', '18 November,2019', 'https://desustream.me/otakuplay/v2/?id=VElZdURRL285U0M2aEpxMkc3VzVwZzM2NW1Ed203Y0xYcCtCdW81b24waz0='), ('Gokukoku no Brynhildr Episode 2 Subtitle Indonesia', 'https://otakudesu.moe/gkk-byldr-episode-2-sub-indo/', '18 November,2019', 'https://desustream.me/otakuplay/v2/?id=VElZdURRL285U0M2aEpxMkc3VzVwZ0JtUzkxOXVyR1lPN0o2S0E5d0pGWT0='), ('Gokukoku no Brynhildr Episode 1 Subtitle Indonesia', 'https://otakudesu.moe/gkk-byldr-episode-1-sub-indo/', '18 November,2019', 'https://desustream.me/otakuplay/v2/?id=VElZdURRL285U0M2aEpxMkc3VzVwamp5ejZWUmM2WE5YTW94dE1VZ2VDST0=')]"
anime308,Golden Kamuy,Golden Kamuy (Episode 1 – 12) Subtitle Indonesia,https://i0.wp.com/otakudesu.moe/wp-content/uploads/2018/05/Golden-Kamuy-Sub-Indo.jpg, Golden Kamuy, ゴールデンカムイ, 7.69," NBCUniversal Entertainment Japan, Tokyo MX, Twin Engine", TV, Completed, 12, 23 Menit / Episode," Apr 9, 2018 sampai Jun 25, 2018", Geno Studio," Action, Adventure, Historical, Seinen","Di Hokkaido, dibagian utara jepang, seorang bernama Sugimoto Saichi merupakan salah satu prajurit veteran yang selamat dari perang antara Rusia – Jepang saat era Meiji dan dijuluki sebagai Manusia Abadi & Tak Terkalahkan.Sugimoto sekarang sedang mencari kekayaan berupa emas untuk menyelamatkan istri dari sahabatnya yang telah gugur dalam perang.Dalam pencariannya, ia menemukan banyak sekali petunjuk-petunjuk bahkan peta yang bersangkutan dengan emas yang disimpan oleh para koruptor. Dan ternyata, bukan hanya dirinya seorang yang mencari harta tersebut melainkan semua orang berlomba-lomba dalam pencarian ini.Bersama dengan seorang gadis bernama Asirpa yang telah menolongnya dari cuaca ekstrim di utara, mereka memulai petualangan yang besar dan bertahan hidup dari berbagai rintangan dalam pencarian harta karun.","[('Golden Kamuy Episode 12 (End) Subtitle Indonesia', 'https://otakudesu.moe/kmygold-episode-12-sub-indo/', '29 Juni,2018', 'https://desustream.me/playdesu/v2/?id=eERQNm1ybUQ4MEpjUFI1Yms2U0p0QW85WkthaHArckNmZmFuM3JCcVdHaz0='), ('Golden Kamuy Episode 11 Subtitle Indonesia', 'https://otakudesu.moe/kmygold-episode-11-sub-indo/', '22 Juni,2018', 'https://desustream.me/playdesu/v2/?id=eERQNm1ybUQ4MEpjUFI1Yms2U0p0R0hIUlVITlNZZi9Sc2JxbDM2d3ZTcz0='), ('Golden Kamuy Episode 10 Subtitle Indonesia', 'https://otakudesu.moe/kmygold-episode-10-sub-indo/', '13 Juni,2018', 'https://desustream.me/playdesu/v2/?id=eERQNm1ybUQ4MEpjUFI1Yms2U0p0QXd0TzUwdW42QVV2VGVDSXAwZllKdz0='), ('Golden Kamuy Episode 9 Subtitle Indonesia', 'https://otakudesu.moe/kmygold-episode-9-sub-indo/', '8 Juni,2018', 'https://desustream.me/playdesu/v2/?id=eERQNm1ybUQ4MEpjUFI1Yms2U0p0TTRRb3oySnY0dFZKTlRmZnp0M2dMbz0='), ('Golden Kamuy Episode 8 Subtitle Indonesia', 'https://otakudesu.moe/kmygold-episode-8-sub-indo/', '31 Mei,2018', 'https://desustream.me/playdesu/v2/?id=eERQNm1ybUQ4MEpjUFI1Yms2U0p0T0crZ3NIdExGcWNHSHNwNVdTNmpRdz0='), ('Golden Kamuy Episode 7 Subtitle Indonesia', 'https://otakudesu.moe/kmygold-episode-7-sub-indo/', '22 Mei,2018', 'https://desustream.me/playdesu/v2/?id=eERQNm1ybUQ4MEpjUFI1Yms2U0p0RjErYjVTS2pxR2tya2JrN0JXL1hOWT0='), ('Golden Kamuy Episode 6 Subtitle Indonesia', 'https://otakudesu.moe/kmygold-episode-6-sub-indo/', '15 Mei,2018', 'https://desustream.me/playdesu/v2/?id=eERQNm1ybUQ4MEpjUFI1Yms2U0p0SzEzNVNXcWFETmQyaVZLcHNsakRubz0='), ('Golden Kamuy Episode 5 Subtitle Indonesia', 'https://otakudesu.moe/kmygold-episode-5-sub-indo/', '9 Mei,2018', 'https://desustream.me/playdesu/v2/?id=eERQNm1ybUQ4MEpjUFI1Yms2U0p0RGgxdmNYWnlPT1gveHlqNXQyNndZaz0='), ('Golden Kamuy Episode 4 Subtitle Indonesia', 'https://otakudesu.moe/kmygold-episode-4-sub-indo/', '9 Mei,2018', 'https://desustream.me/playdesu/v2/?id=eERQNm1ybUQ4MEpjUFI1Yms2U0p0SHV0VDN0dUNzQnl2enNDMVdQSTgwOD0='), ('Golden Kamuy Episode 3 Subtitle Indonesia', 'https://otakudesu.moe/kmygold-episode-3-sub-indo/', '9 Mei,2018', 'https://desustream.me/playdesu/v2/?id=eERQNm1ybUQ4MEpjUFI1Yms2U0p0SGRUT3ROcmY4Mkxxb1BzN3dKYWppbz0='), ('Golden Kamuy Episode 2 Subtitle Indonesia', 'https://otakudesu.moe/kmygold-episode-2-sub-indo/', '9 Mei,2018', 'https://desustream.me/playdesu/v2/?id=eERQNm1ybUQ4MEpjUFI1Yms2U0p0Rms4c1hPRDdNdFBiZkxycVp0STVORT0='), ('Golden Kamuy Episode 1 Subtitle Indonesia', 'https://otakudesu.moe/kmygold-episode-1-sub-indo/', '9 Mei,2018', 'https://desustream.me/playdesu/v2/?id=eERQNm1ybUQ4MEpjUFI1Yms2U0p0RlRnZ0ZmOGh4MVM5SVpNMDBxblpCcz0=')]"
anime309,Golden Kamuy Season 2,Golden Kamuy Season 2 (Episode 1 – 12) Subtitle Indonesia,https://i0.wp.com/otakudesu.moe/wp-content/uploads/2019/05/Golden-Kamuy-Season-2-Sub-Indo.jpg, Golden Kamuy Season 2, ゴールデンカムイ 第二期, 8.17," Magic Capsule, NBCUniversal Entertainment Japan, Tokyo MX, Good Smile Company, Sammy, Shueisha, East Japan Marketing & Communications, Twin Engine", BD, Completed, 12, 23 Menit / Episode," Oct 8, 2018", Geno Studio," Action, Adventure, Historical, Seinen","Season 2 dari anime Golden Kamuy.Di Hokkaido, dibagian utara jepang, seorang bernama Sugimoto Saichi merupakan salah satu prajurit veteran yang selamat dari perang antara Rusia – Jepang saat era Meiji dan dijuluki sebagai Manusia Abadi & Tak Terkalahkan.Sugimoto sekarang sedang mencari kekayaan berupa emas untuk menyelamatkan istri dari sahabatnya yang telah gugur dalam perang.Dalam pencariannya, ia menemukan banyak sekali petunjuk-petunjuk bahkan peta yang bersangkutan dengan emas yang disimpan oleh para koruptor. Dan ternyata, bukan hanya dirinya seorang yang mencari harta tersebut melainkan semua orang berlomba-lomba dalam pencarian ini.Bersama dengan seorang gadis bernama Asirpa yang telah menolongnya dari cuaca ekstrim di utara, mereka memulai petualangan yang besar dan bertahan hidup dari berbagai rintangan dalam pencarian harta karun.","[('Golden Kamuy Season 2 Episode 12 (End) Subtitle Indonesia', 'https://otakudesu.moe/kmygld-s2-episode-12-sub-indo/', '8 Mei,2019', 'https://desustream.me/playdesu/v2/?id=eERQNm1ybUQ4MEpjUFI1Yms2U0p0SmdpeDVjMWhwMVFacmRURzZSWkFIbz0='), ('Golden Kamuy Season 2 Episode 11 Subtitle Indonesia', 'https://otakudesu.moe/kmygld-s2-episode-11-sub-indo/', '8 Mei,2019', 'https://desustream.me/playdesu/v2/?id=eERQNm1ybUQ4MEpjUFI1Yms2U0p0Sm5PY1FOand4ZWR3Q3pmYzdSWDNWMD0='), ('Golden Kamuy Season 2 Episode 10 Subtitle Indonesia', 'https://otakudesu.moe/kmygld-s2-episode-10-sub-indo/', '8 Mei,2019', 'https://desustream.me/playdesu/v2/?id=eERQNm1ybUQ4MEpjUFI1Yms2U0p0R0tTdzltcTYwY2xyZC9lOWRQSGp3bz0='), ('Golden Kamuy Season 2 Episode 9 Subtitle Indonesia', 'https://otakudesu.moe/kmygld-s2-episode-9-sub-indo/', '8 Mei,2019', 'https://desustream.me/playdesu/v2/?id=eERQNm1ybUQ4MEpjUFI1Yms2U0p0Q1BHTW5yVGdwMGRZUUVUazNWVjl5az0='), ('Golden Kamuy Season 2 Episode 8 Subtitle Indonesia', 'https://otakudesu.moe/kmygld-s2-episode-8-sub-indo/', '8 Mei,2019', 'https://desustream.me/playdesu/v2/?id=eERQNm1ybUQ4MEpjUFI1Yms2U0p0Rjh4MDJER3Uzc1FzaTBLWXdVY1ZTND0='), ('Golden Kamuy Season 2 Episode 7 Subtitle Indonesia', 'https://otakudesu.moe/kmygld-s2-episode-7-sub-indo/', '8 Mei,2019', 'https://desustream.me/playdesu/v2/?id=eERQNm1ybUQ4MEpjUFI1Yms2U0p0SnkybHhxdEtsT2EzVE9DOGtkME9xTT0='), ('Golden Kamuy Season 2 Episode 6 Subtitle Indonesia', 'https://otakudesu.moe/kmygld-s2-episode-6-sub-indo/', '8 Mei,2019', 'https://desustream.me/playdesu/v2/?id=eERQNm1ybUQ4MEpjUFI1Yms2U0p0RHhrSFI2cWdENFJCOWlLbVhIbzRSaz0='), ('Golden Kamuy Season 2 Episode 5 Subtitle Indonesia', 'https://otakudesu.moe/kmygld-s2-episode-5-sub-indo/', '8 Mei,2019', 'https://desustream.me/playdesu/v2/?id=eERQNm1ybUQ4MEpjUFI1Yms2U0p0SFBDckVUaXR1RzdNK3dmeHRXemJnST0='), ('Golden Kamuy Season 2 Episode 4 Subtitle Indonesia', 'https://otakudesu.moe/kmygld-s2-episode-4-sub-indo/', '8 Mei,2019', 'https://desustream.me/playdesu/v2/?id=eERQNm1ybUQ4MEpjUFI1Yms2U0p0TnhZUDgwMi9TUy8vdUF5YlFSNUVOcz0='), ('Golden Kamuy Season 2 Episode 3 Subtitle Indonesia', 'https://otakudesu.moe/kmygld-s2-episode-3-sub-indo/', '8 Mei,2019', 'https://desustream.me/playdesu/v2/?id=eERQNm1ybUQ4MEpjUFI1Yms2U0p0TVFVaXIvV0tJalNGSGRDNEhZVVhTMD0='), ('Golden Kamuy Season 2 Episode 2 Subtitle Indonesia', 'https://otakudesu.moe/kmygld-s2-episode-2-sub-indo/', '8 Mei,2019', 'https://desustream.me/playdesu/v2/?id=eERQNm1ybUQ4MEpjUFI1Yms2U0p0SHdXZmRjREw2c2hEcGk1UDd6NGhnaz0='), ('Golden Kamuy Season 2 Episode 1 Subtitle Indonesia', 'https://otakudesu.moe/kmygld-s2-episode-1-sub-indo/', '8 Mei,2019', 'https://desustream.me/playdesu/v2/?id=eERQNm1ybUQ4MEpjUFI1Yms2U0p0SHE3aFJlbm0wVjlQN3NDZXJYWXpXdz0=')]"
anime310,Golden Kamuy Season 3,Golden Kamuy Season 3 (Episode 1 – 12) Subtitle Indonesia,https://i0.wp.com/otakudesu.moe/wp-content/uploads/2020/10/Golden-Kamuy-Season-3-Sub-Indo.jpg, Golden Kamuy Season 3, ゴールデンカムイ, 8.47," Magic Capsule, NBCUniversal Entertainment Japan", TV, Completed, 12, 23 Menit," Oct 5, 2020", Geno Studio," Action, Adventure, Historical, Seinen",Season ke-3 dari anime Golden Kamuy,"[('Golden Kamuy Season 3 Episode 12 (End) Subtitle Indonesia', 'https://otakudesu.moe/kmygold-s3-episode-12-sub-indo/', '8 Januari,2021', 'https://desustream.me/otakuplay/v2/?id=VkdVemRCbTNZQ0Y2Qmt4MkFtc0JSd2ZhbEM1a01zRVh1aFpuQkdUNmdvWT0='), ('Golden Kamuy Season 3 Episode 11 Subtitle Indonesia', 'https://otakudesu.moe/kmygold-s3-episode-11-sub-indo/', '8 Januari,2021', 'https://desustream.me/otakuplay/v2/?id=KzAwRHByNlA0a3QyOVJCN2h3NS8rYnU2VFp1WTZjSk9uTHdha2hXRGY5QT0='), ('Golden Kamuy Season 3 Episode 10 Subtitle Indonesia', 'https://otakudesu.moe/kmygold-s3-episode-10-sub-indo/', '8 Januari,2021', 'https://desustream.me/otakuplay/v2/?id=VVh2ZGc1ZFM0d0w1VnNvVXhIajk0R0dZL3o1MzdaRDgrbWV3eWMxNW5NZz0='), ('Golden Kamuy Season 3 Episode 9 Subtitle Indonesia', 'https://otakudesu.moe/kmygold-s3-episode-9-sub-indo/', '8 Januari,2021', 'https://desustream.me/otakuplay/v2/?id=OENDU28zbnUrNU1pNlB5RHI3S1BJZz09'), ('Golden Kamuy Season 3 Episode 8 Subtitle Indonesia', 'https://otakudesu.moe/kmygold-s3-episode-8-sub-indo/', '8 Januari,2021', 'https://desustream.me/otakuplay/v2/?id=Z0V3STdBQ1F3OHFuYlhtZnJwanpYZz09'), ('Golden Kamuy Season 3 Episode 7 Subtitle Indonesia', 'https://otakudesu.moe/kmygold-s3-episode-7-sub-indo/', '8 Januari,2021', 'https://desustream.me/otakuplay/v2/?id=NVVMVTFSQWMzem55anczQkkyTS8xUT09'), ('Golden Kamuy Season 3 Episode 6 Subtitle Indonesia', 'https://otakudesu.moe/kmygold-s3-episode-6-sub-indo/', '8 Januari,2021', 'https://desustream.me/otakuplay/v2/?id=cklUNVZjZ0wxTDJSRk1CVnQvbVp1Zz09'), ('Golden Kamuy Season 3 Episode 5 Subtitle Indonesia', 'https://otakudesu.moe/kmygold-s3-episode-5-sub-indo/', '8 Januari,2021', 'https://desustream.me/otakuplay/v2/?id=RHhmSG82dUtvWEQ2QWhCMDFmNWVMdz09'), ('Golden Kamuy Season 3 Episode 4 Subtitle Indonesia', 'https://otakudesu.moe/kmygold-s3-episode-4-sub-indo/', '8 Januari,2021', 'https://desustream.me/otakuplay/v2/?id=TXgwZ2J3NUl0VEo4L29MeEZ6eGx5UT09'), ('Golden Kamuy Season 3 Episode 3 Subtitle Indonesia', 'https://otakudesu.moe/kmygold-s3-episode-3-sub-indo/', '8 Januari,2021', 'https://desustream.me/otakuplay/v2/?id=TXhuS0NBUkJpOUxHMk90Y3dvb2NDdz09'), ('Golden Kamuy Season 3 Episode 2 Subtitle Indonesia', 'https://otakudesu.moe/kmygold-s3-episode-2-sub-indo/', '8 Januari,2021', 'https://desustream.me/otakuplay/v2/?id=djVPUllrL1dNRnNDU3JEZEJIaFFCQT09'), ('Golden Kamuy Season 3 Episode 1 Subtitle Indonesia', 'https://otakudesu.moe/kmygold-s3-episode-1-sub-indo/', '8 Januari,2021', 'https://desustream.me/otakuplay/v2/?id=U0JFZ1BIbCtjTVZxWXVJMzZlN1FXdz09')]"
