id,title,title_detail,img,title_ori,title_jpn,skor,produser,tipe,status,total_eps,durasi,tgl_rilis,studio,genre,data_sinopsis,data_eps
anime311,Golden Time,Golden Time BD (Episode 1 – 24) Subtitle Indonesia,https://i0.wp.com/otakudesu.moe/wp-content/uploads/2017/12/Golden-Time-Sub-Indo.jpg, Golden Time, ゴールデンタイム, 7.90," Genco, Starchild Records", BD, Completed, 24, 24 Menit / Episode," Oct 4, 2013 sampai Mar 28, 2014", J.C.Staff," Comedy, Romance","Bercerita tentang seorang Mahasiswa bernama Tada Banri, ia kini baru saja pindah ke salah satu universitas yang ada di Tokyo. Ini merupakan kehidupan baru bagi Banri, kenapa? karena sebelumnya Banri mengalami kecelakaan yang membuat dirinya melupakan hampir semua ingatan masa lalunya.Ia akan memulai hidup barunya dari sini, saat pertama kali ingin pergi kekampusnya banri kesasar karena tak tahu arah dan bertemu dengan Yanagisawa Mitsuo yang juga kesasar sama seperti dirinya.Saat sampai, Banri dikejutkan dengan munculnya seorang gadis bernama Kaga Kouko yang ternyata merupakan pacar dari Yana, pertemuan mereka bertiga inilah yang akan menjadi kehidupan baru bagi Banri.Disinilah awal cerita Banri bersama teman-teman barunya, ditambah dengan kisah cinta yang rumit dan ingatan Banri yang perlahan menghantui dirinya dan akan membuka misteri tentang orang yang ia cintai selama ini.","[('Golden Time Episode 24 (End) Subtitle Indonesia', 'https://otakudesu.moe/gdtaemu-episode-24-sub-indo/', '29 Juni,2019', 'https://desustream.me/playdesu/v2/?id=cXp1TmlwUllNQzBHNnhHVmI2VjhudUJ5NFJKMmRaUkRrOGNER3RPMXhCaz0='), ('Golden Time Episode 23 Subtitle Indonesia', 'https://otakudesu.moe/gdtaemu-episode-23-sub-indo/', '29 Juni,2019', 'https://desustream.me/playdesu/v2/?id=cXp1TmlwUllNQzBHNnhHVmI2VjhubGpObk1aTElRM25WdUxMNlJYVE9lWT0='), ('Golden Time Episode 22 Subtitle Indonesia', 'https://otakudesu.moe/gdtaemu-episode-22-sub-indo/', '29 Juni,2019', 'https://desustream.me/playdesu/v2/?id=cXp1TmlwUllNQzBHNnhHVmI2VjhuaS8rbmNWVndZRHp5bkFaaUlhbnBuYz0='), ('Golden Time Episode 21 Subtitle Indonesia', 'https://otakudesu.moe/gdtaemu-episode-21-sub-indo/', '29 Juni,2019', 'https://desustream.me/playdesu/v2/?id=cXp1TmlwUllNQzBHNnhHVmI2VjhucllJOERIU3dWY3BGQ2NlSGVBYVBHUT0='), ('Golden Time Episode 20 Subtitle Indonesia', 'https://otakudesu.moe/gdtaemu-episode-20-sub-indo/', '29 Juni,2019', 'https://desustream.me/playdesu/v2/?id=cXp1TmlwUllNQzBHNnhHVmI2VjhualNBeXBTblBEN1NlbGRHVXc4RzZ3Zz0='), ('Golden Time Episode 19 Subtitle Indonesia', 'https://otakudesu.moe/gdtaemu-episode-19-sub-indo/', '29 Juni,2019', 'https://desustream.me/playdesu/v2/?id=cXp1TmlwUllNQzBHNnhHVmI2VjhuanFBZUxZcFZIYmxlTWhhb2dHLzNsaz0='), ('Golden Time Episode 18 Subtitle Indonesia', 'https://otakudesu.moe/gdtaemu-episode-18-sub-indo/', '29 Juni,2019', 'https://desustream.me/playdesu/v2/?id=cXp1TmlwUllNQzBHNnhHVmI2Vjhub2VIc2lzK0ZxK2hkU1pWN2l4dnNsST0='), ('Golden Time Episode 17 Subtitle Indonesia', 'https://otakudesu.moe/gdtaemu-episode-17-sub-indo/', '29 Juni,2019', 'https://desustream.me/playdesu/v2/?id=cXp1TmlwUllNQzBHNnhHVmI2Vjhua000MGZSbE5Oa3Y2aFZHMzBhb1NEQT0='), ('Golden Time Episode 16 Subtitle Indonesia', 'https://otakudesu.moe/gdtaemu-episode-16-sub-indo/', '29 Juni,2019', 'https://desustream.me/playdesu/v2/?id=cXp1TmlwUllNQzBHNnhHVmI2Vjhub3JEZldoUVBScnVyMFZhU1FDcjZkZz0='), ('Golden Time Episode 15 Subtitle Indonesia', 'https://otakudesu.moe/gdtaemu-episode-15-sub-indo/', '29 Juni,2019', 'https://desustream.me/playdesu/v2/?id=cXp1TmlwUllNQzBHNnhHVmI2Vjhuc1U1ZEdHRzhDNHJSeXN4N2I3SmxJZz0='), ('Golden Time Episode 14 Subtitle Indonesia', 'https://otakudesu.moe/gdtaemu-episode-14-sub-indo/', '29 Juni,2019', 'https://desustream.me/playdesu/v2/?id=cXp1TmlwUllNQzBHNnhHVmI2VjhuaDBxNk5NTlcyckZxY3k0RW1iaUlmYz0='), ('Golden Time Episode 13 Subtitle Indonesia', 'https://otakudesu.moe/gdtaemu-episode-13-sub-indo/', '29 Juni,2019', 'https://desustream.me/playdesu/v2/?id=cXp1TmlwUllNQzBHNnhHVmI2VjhubllCTXNoTzFlOEdiQjhLM3lwUmFrUT0='), ('Golden Time Episode 12 Subtitle Indonesia', 'https://otakudesu.moe/gdtaemu-episode-12-sub-indo/', '29 Juni,2019', 'https://desustream.me/playdesu/v2/?id=cXp1TmlwUllNQzBHNnhHVmI2Vjhub0lwUyswN1FzR0M3b1RaN0oyemFRYz0='), ('Golden Time Episode 11 Subtitle Indonesia', 'https://otakudesu.moe/gdtaemu-episode-11-sub-indo/', '29 Juni,2019', 'https://desustream.me/playdesu/v2/?id=cXp1TmlwUllNQzBHNnhHVmI2VjhuaFczNHlld2p6SDF3c3NBbUJWclVQRT0='), ('Golden Time Episode 10 Subtitle Indonesia', 'https://otakudesu.moe/gdtaemu-episode-10-sub-indo-2/', '29 Juni,2019', 'https://desustream.me/playdesu/v2/?id=cXp1TmlwUllNQzBHNnhHVmI2VjhudThiNmhaYVlnODdzRmhtOWEwZFhyND0='), ('Golden Time Episode 9 Subtitle Indonesia', 'https://otakudesu.moe/gdtaemu-episode-9-sub-indo/', '29 Juni,2019', 'https://desustream.me/playdesu/v2/?id=cXp1TmlwUllNQzBHNnhHVmI2VjhubVl6c05mdHRkM1ZlZ3FsMWNiZUwvVT0='), ('Golden Time Episode 8 Subtitle Indonesia', 'https://otakudesu.moe/gdtaemu-episode-8-sub-indo/', '29 Juni,2019', 'https://desustream.me/playdesu/v2/?id=cXp1TmlwUllNQzBHNnhHVmI2VjhucEV2dSt3dzJ1WWltUmduc3V3N0FiQT0='), ('Golden Time Episode 7 Subtitle Indonesia', 'https://otakudesu.moe/gdtaemu-episode-10-sub-indo/', '29 Juni,2019', 'https://desustream.me/playdesu/v2/?id=cXp1TmlwUllNQzBHNnhHVmI2VjhuaUREV29MekUzMjNqM20rbG9uNk9GVT0='), ('Golden Time Episode 6 Subtitle Indonesia', 'https://otakudesu.moe/gdtaemu-episode-6-sub-indo/', '29 Juni,2019', 'https://desustream.me/playdesu/v2/?id=cXp1TmlwUllNQzBHNnhHVmI2VjhuaU4wNWVFZ0VRdlF4MTVVU084TzFscz0='), ('Golden Time Episode 5 Subtitle Indonesia', 'https://otakudesu.moe/gdtaemu-episode-5-sub-indo/', '29 Juni,2019', 'https://desustream.me/playdesu/v2/?id=cXp1TmlwUllNQzBHNnhHVmI2VjhudE0yZjFhNmM2VzhCdUJibG5GOTVWTT0='), ('Golden Time Episode 4 Subtitle Indonesia', 'https://otakudesu.moe/gdtaemu-episode-4-sub-indo/', '29 Juni,2019', 'https://desustream.me/playdesu/v2/?id=cXp1TmlwUllNQzBHNnhHVmI2VjhudnVjaHJoQ3JudHhJbWpVTXNUdTNCYz0='), ('Golden Time Episode 3 Subtitle Indonesia', 'https://otakudesu.moe/gdtaemu-episode-3-sub-indo/', '29 Juni,2019', 'https://desustream.me/playdesu/v2/?id=cXp1TmlwUllNQzBHNnhHVmI2VjhuaVlZeWFsa05VS1ROQ0FhcWpZSFpVND0='), ('Golden Time Episode 2 Subtitle Indonesia', 'https://otakudesu.moe/gdtaemu-episode-2-sub-indo/', '29 Juni,2019', 'https://desustream.me/playdesu/v2/?id=cXp1TmlwUllNQzBHNnhHVmI2VjhuaUx1a0xBbDl6OEZOejYycnA2dVMybz0='), ('Golden Time Episode 1 Subtitle Indonesia', 'https://otakudesu.moe/gdtaemu-episode-1-sub-indo/', '29 Juni,2019', 'https://desustream.me/playdesu/v2/?id=cXp1TmlwUllNQzBHNnhHVmI2VjhubDdMRVVwaE4yNkJkdHVGRVdCVjNzbz0=')]"
anime312,Gosick,Gosick BD (Episode 1 – 24) Subtitle Indonesia,https://i0.wp.com/otakudesu.moe/wp-content/uploads/2017/11/Gosick-Sub-Indo.jpg, Gosick, GOSICK -ゴシック-, 8.21," TV Tokyo, Kadokawa Shoten, KlockWorx, Memory-Tech, NTT Docomo", BD, Completed, 24, 20 Menit / Episode," Jan 8, 2011 sampai Jul 2, 2011", Bones," Drama, Historical, Mystery, Romance","Berlatar waktu di tahun 1924-an Bercerita tentang seorang pemuda bernama Kujou Kazuya yang baru saja pindah dari jepang dan bersekolah di Akademi St. Marguerite.Baru saja pindah kesana ia sudah dijuluki dengan “The black reaper who comes in spring” yang merupakan salah satu legenda cerita hantu yang tersebar di sekolah. Hal itu disebabkan karena ia yang memiliki mata dan rambut berwarna hitam yang membuatnya susah untuk mencari teman.Ada sebuah tradisi aneh di Akademi tersebut dimana seseorang yang ingin berteman dengan murid lainnya harus saling menceritakan kisah hantu yang mereka miliki. Wali kelas Kujou menyarankannya untuk ke perpustakaan dan membaca buku mengenai legenda hantu.Disanalah Kujou bertemu dengan seorang gadis cantik, mungil, penyendiri yang memiliki sifat buruk namun ia sangat jenius, apalagi dalam memecahkan misteri, ia bernama Victorique. Victorique sendiri yang setiap harinya membolos dan hanya berdiam diri di perpustakaan membuat Kujou berulang-ulang kembali kesana untuk mengunjungi victorique.Hingga akhirnya banyak sekali misteri bahkan sampai kasus pembunuhan yang harus mereka lewati.Disinilah cerita mereka dimulai dengan banyak kasus tanpa henti yang harus mereka lewati bahkan harus mengancam nyawa mereka","[('Gosick Episode 24 (End) Subtitle Indonesia', 'https://otakudesu.moe/g-sick-episode-24-sub-indo/', '11 November,2017', 'https://desustream.me/playdesu/v2/?id=aGJiTlRLcDh6QXhzWWFjdDR5TkpWakMybStjRXk5R0hiQ254eWp5K251ST0='), ('Gosick Episode 23 Subtitle Indonesia', 'https://otakudesu.moe/g-sick-episode-23-sub-indo/', '11 November,2017', 'https://desustream.me/playdesu/v2/?id=aGJiTlRLcDh6QXhzWWFjdDR5TkpWa2k3Y1VUdUlQMEFpbWZ0b2MwcHR5bz0='), ('Gosick Episode 22 Subtitle Indonesia', 'https://otakudesu.moe/g-sick-episode-22-sub-indo/', '11 November,2017', 'https://desustream.me/playdesu/v2/?id=aGJiTlRLcDh6QXhzWWFjdDR5TkpWa2VTRlBobFJnYktCZVFJTVAvSHpMND0='), ('Gosick Episode 21 Subtitle Indonesia', 'https://otakudesu.moe/g-sick-episode-21-sub-indo/', '11 November,2017', 'https://desustream.me/playdesu/v2/?id=aGJiTlRLcDh6QXhzWWFjdDR5TkpWbjdmVUIyN1h1WjA1ZEtiS0FwLzgyRT0='), ('Gosick Episode 20 Subtitle Indonesia', 'https://otakudesu.moe/g-sick-episode-20-sub-indo/', '11 November,2017', 'https://desustream.me/playdesu/v2/?id=aGJiTlRLcDh6QXhzWWFjdDR5TkpWczV3ZDRwSDBiTTQ0TkF5ZlpsN0l3MD0='), ('Gosick Episode 19 Subtitle Indonesia', 'https://otakudesu.moe/g-sick-episode-19-sub-indo/', '11 November,2017', 'https://desustream.me/playdesu/v2/?id=d3VoNEtWRkFrTjk2NGlXVDY2bjA3UFNyUVJ2bXdhUlNXSUk0YkFzVzc1Zz0='), ('Gosick Episode 18 Subtitle Indonesia', 'https://otakudesu.moe/g-sick-episode-18-sub-indo/', '11 November,2017', 'https://desustream.me/playdesu/v2/?id=d3VoNEtWRkFrTjk2NGlXVDY2bjA3TVVkTlFNbHhMWENHaXBDN29uclowOD0='), ('Gosick Episode 17 Subtitle Indonesia', 'https://otakudesu.moe/g-sick-episode-17-sub-indo/', '11 November,2017', 'https://desustream.me/playdesu/v2/?id=d3VoNEtWRkFrTjk2NGlXVDY2bjA3S2htQkU1RytxQm1sRi9UcElnTXgwWT0='), ('Gosick Episode 16 Subtitle Indonesia', 'https://otakudesu.moe/g-sick-episode-16-sub-indo/', '11 November,2017', 'https://desustream.me/playdesu/v2/?id=d3VoNEtWRkFrTjk2NGlXVDY2bjA3T01rTkdNRXRDZlEya2NYbDkwaU9mVT0='), ('Gosick Episode 15 Subtitle Indonesia', 'https://otakudesu.moe/g-sick-episode-15-sub-indo/', '11 November,2017', 'https://desustream.me/playdesu/v2/?id=d3VoNEtWRkFrTjk2NGlXVDY2bjA3Tyt6NVA2eVFVTWd3NUpSRjFUWEZaaz0='), ('Gosick Episode 14 Subtitle Indonesia', 'https://otakudesu.moe/g-sick-episode-14-sub-indo/', '11 November,2017', 'https://desustream.me/playdesu/v2/?id=d3VoNEtWRkFrTjk2NGlXVDY2bjA3SnhJOGxaZm1XbFEyTU5DYnQ5eFA5dz0='), ('Gosick Episode 13 Subtitle Indonesia', 'https://otakudesu.moe/g-sick-episode-13-sub-indo/', '11 November,2017', 'https://desustream.me/playdesu/v2/?id=d3VoNEtWRkFrTjk2NGlXVDY2bjA3RDFoaWYzY200dk05RlB6Q0N3elBFaz0='), ('Gosick Episode 12 Subtitle Indonesia', 'https://otakudesu.moe/g-sick-episode-12-sub-indo/', '11 November,2017', 'https://desustream.me/playdesu/v2/?id=d3VoNEtWRkFrTjk2NGlXVDY2bjA3UGNNR29mWDlnM29sK2xVTzh0STJwVT0='), ('Gosick Episode 11 Subtitle Indonesia', 'https://otakudesu.moe/g-sick-episode-11-sub-indo/', '11 November,2017', 'https://desustream.me/playdesu/v2/?id=d3VoNEtWRkFrTjk2NGlXVDY2bjA3UHNvOEJtZFl3MFlab002ei93ME8yYz0='), ('Gosick Episode 10 Subtitle Indonesia', 'https://otakudesu.moe/g-sick-episode-10-sub-indo/', '11 November,2017', 'https://desustream.me/playdesu/v2/?id=d3VoNEtWRkFrTjk2NGlXVDY2bjA3UGRkTG03WW1vT0VOY3hsdDBvUW9JRT0='), ('Gosick Episode 9 Subtitle Indonesia', 'https://otakudesu.moe/g-sick-episode-9-sub-indo/', '11 November,2017', 'https://desustream.me/playdesu/v2/?id=VzJIWFZLR3ZGS29qSEE2T0dMZ29pSStLdmNzWThJbU84VTkvV0drN1F4Zz0='), ('Gosick Episode 8 Subtitle Indonesia', 'https://otakudesu.moe/g-sick-episode-8-sub-indo/', '11 November,2017', 'https://desustream.me/playdesu/v2/?id=NU55QnU0MmxycVF0YUtseFNUdlIyNzJZcC8wYmNMWHlEa296a3dsZldsMD0='), ('Gosick Episode 7 Subtitle Indonesia', 'https://otakudesu.moe/g-sick-episode-7-sub-indo/', '11 November,2017', 'https://desustream.me/playdesu/v2/?id=OUluNld2NVNSRWVtUXpuNWJpZHBCa1B3ckk0NWNDL2VkUk9hM3VsdFVUTT0='), ('Gosick Episode 6 Subtitle Indonesia', 'https://otakudesu.moe/g-sick-episode-6-sub-indo/', '11 November,2017', 'https://desustream.me/playdesu/v2/?id=aHlPekx4Z1VUREZMTzBDU0w0M2xtSk1hSENMTXRwRlhoUjNDZlgwOThpVT0='), ('Gosick Episode 5 Subtitle Indonesia', 'https://otakudesu.moe/g-sick-episode-5-sub-indo/', '11 November,2017', 'https://desustream.me/playdesu/v2/?id=Wm4xand6OG9GbmV4WG84TFNBbVVLY01RTGRqWXpNVlVPSVZ1VmZRcTd5bz0='), ('Gosick Episode 4 Subtitle Indonesia', 'https://otakudesu.moe/sikgoc-episode-4-sub-indo/', '11 November,2017', 'https://desustream.me/playdesu/v2/?id=WmpyNnJiNjc4dTBIR1dlanpwYzN6RTBnR3MxbDJ4a2xQQmlFODVLcUUyQT0='), ('Gosick Episode 3 Subtitle Indonesia', 'https://otakudesu.moe/sikgoc-episode-3-sub-indo/', '11 November,2017', 'https://desustream.me/playdesu/v2/?id=Z3YwLzNBNzJqWUxqSkx6c2hBUGk0YWRTQnhBVGFtaDJmY01waGVQZU5Ybz0='), ('Gosick Episode 2 Subtitle Indonesia', 'https://otakudesu.moe/sikgoc-episode-2-sub-indo/', '11 November,2017', 'https://desustream.me/playdesu/v2/?id=aGJiTlRLcDh6QXhzWWFjdDR5TkpWdDNJQTRtRHhnbjhiVmJxNGlxTE5rYz0='), ('Gosick Episode 1 Subtitle Indonesia', 'https://otakudesu.moe/sikgoc-episode-1-sub-indo/', '11 November,2017', 'https://desustream.me/playdesu/v2/?id=d3VoNEtWRkFrTjk2NGlXVDY2bjA3TG1rWE16TDNuS2plaWUvbjVzTjhWVT0=')]"
anime313,Gotoubun no Hanayome,Gotoubun no Hanayome (Episode 1 – 12) Subtitle Indonesia,https://i0.wp.com/otakudesu.moe/wp-content/uploads/2019/01/Gotoubun-no-Hanayome-Sub-Indo.jpg, Gotoubun no Hanayome, 五等分の花嫁, 7.67, -, TV, Completed, 12, 24 Menit," Jan 11, 2019", Tezuka Productions," Comedy, Harem, Romance, School, Shounen","Fuutarou Uesugi merupakan siswa cerdas namun memiliki hidup yang sulit. Fuutarou selalu menyendiri dan fokus terhadap belajar, tidak memiliki ibu serta teman, keluarganya dililit banyak hutang, bahkan ia dan adiknya seringkali merasa kelaparan.Oleh karena itu, kesempatan yang muncul di depannya tak akan ia lepaskan. Ia dimintai oleh seseorang untuk menjadi guru les dengan bayaran yang tinggi. Dan ternyata murid yang harus Fuutarou ajari satu sekolah dengan dirinya.Dan terlebih lagi, ia harus mengajar untuk kakak beradik kembar 5 yang memiliki sifat berbeda-beda, mereka tidak suka belajar dan memiliki nilai yang sangat rendah serta berkesempatan besar untuk tidak naik kelas.Sebagian dari mereka ada yang menolak untuk diajari bahkan mengusir Fuutarou. Hal tersebut membuat pekerjaan paruh waktunya menjadi rumit & sulit. Namun Fuutarou tak pantang menyerah, ia bersikeras untuk menjadi pengajar mereka karena dirinya sangat membutuhkan bayaran tersebut.Apa yang harus dia lakukan agar kelima gadis cantik tersebut dapat lulus? rencana apakah yang akan dilakukan oleh Fuutarou?","[('Gotoubun no Hanayome Episode 12 (End) Subtitle Indonesia', 'https://otakudesu.moe/gth-episode-12-sub-indo/', '18 Agustus,2019', 'https://desustream.me/playdesu/v2/?id=ZmIxaUhPM2NTakxYckFZQXAwRlVtbGtmYnR6Q2szblI5L1czbXBLVG1kbz0='), ('Gotoubun no Hanayome Episode 11 Subtitle Indonesia', 'https://otakudesu.moe/gth-episode-11-sub-indo/', '18 Agustus,2019', 'https://desustream.me/playdesu/v2/?id=ZmIxaUhPM2NTakxYckFZQXAwRlVtdkJkRGdHczRabmFSNloyc3ZVKzlkWT0='), ('Gotoubun no Hanayome Episode 10 Subtitle Indonesia', 'https://otakudesu.moe/gth-episode-10-sub-indo/', '18 Agustus,2019', 'https://desustream.me/playdesu/v2/?id=ZmIxaUhPM2NTakxYckFZQXAwRlVtdXRhVk5oakUvVURNN1I5RndFVTA1TT0='), ('Gotoubun no Hanayome Episode 9 Subtitle Indonesia', 'https://otakudesu.moe/gth-episode-9-sub-indo/', '18 Agustus,2019', 'https://desustream.me/playdesu/v2/?id=ZmIxaUhPM2NTakxYckFZQXAwRlVtc3FLV2Mwb3d2MDZZdkY5R3JMb3doRT0='), ('Gotoubun no Hanayome Episode 8 Subtitle Indonesia', 'https://otakudesu.moe/gth-episode-8-sub-indo/', '18 Agustus,2019', 'https://desustream.me/playdesu/v2/?id=ZmIxaUhPM2NTakxYckFZQXAwRlVtbmhHK09XOEtNM254czk3UkJtZGJjST0='), ('Gotoubun no Hanayome Episode 7 Subtitle Indonesia', 'https://otakudesu.moe/gth-episode-7-sub-indo/', '18 Agustus,2019', 'https://desustream.me/playdesu/v2/?id=ZmIxaUhPM2NTakxYckFZQXAwRlVtaTJUMlEzcXdzKzRmTGxrbm00R1JROD0='), ('Gotoubun no Hanayome Episode 6 Subtitle Indonesia', 'https://otakudesu.moe/gth-episode-6-sub-indo/', '18 Agustus,2019', 'https://desustream.me/playdesu/v2/?id=ZmIxaUhPM2NTakxYckFZQXAwRlVtcG9qa3llRU54MkNkSTlGa2RDRlBlMD0='), ('Gotoubun no Hanayome Episode 5 Subtitle Indonesia', 'https://otakudesu.moe/gth-episode-5-sub-indo/', '18 Agustus,2019', 'https://desustream.me/playdesu/v2/?id=ZmIxaUhPM2NTakxYckFZQXAwRlVtbTlQeHJSRDhlYTlpWTJBcCtEcUV1dz0='), ('Gotoubun no Hanayome Episode 4 Subtitle Indonesia', 'https://otakudesu.moe/gth-episode-4-sub-indo/', '18 Agustus,2019', 'https://desustream.me/playdesu/v2/?id=ZmIxaUhPM2NTakxYckFZQXAwRlVtdmFDbXFaMFVYYWpXM0t3a2N0YlBuND0='), ('Gotoubun no Hanayome Episode 3 Subtitle Indonesia', 'https://otakudesu.moe/gth-episode-3-sub-indo/', '18 Agustus,2019', 'https://desustream.me/playdesu/v2/?id=ZmIxaUhPM2NTakxYckFZQXAwRlVtajZadENqNGlTZ2JlYlUraGFqYlFqYz0='), ('Gotoubun no Hanayome Episode 2 Subtitle Indonesia', 'https://otakudesu.moe/gth-episode-2-sub-indo/', '18 Agustus,2019', 'https://desustream.me/playdesu/v2/?id=ZmIxaUhPM2NTakxYckFZQXAwRlVtaWZoSkc4djRLdzRtaDVIM0ZoK1lHbz0='), ('Gotoubun no Hanayome Episode 1 Subtitle Indonesia', 'https://otakudesu.moe/gth-episode-1-sub-indo/', '18 Agustus,2019', 'https://desustream.me/playdesu/v2/?id=ZmIxaUhPM2NTakxYckFZQXAwRlVtck1yaVAwTVlyZmFpbDBubXozTFQyVT0=')]"
anime314,Gotoubun no Hanayome Season 2,Gotoubun no Hanayome Season 2 (Episode 1 – 12) Subtitle Indonesia,https://i0.wp.com/otakudesu.moe/wp-content/uploads/2021/01/gotoubun-no-hanayome-s2.jpg, Gotoubun no Hanayome Season 2, 五等分の花嫁∬, 8.16," DAX Production, Nichion", TV, Completed, 12, 24 Menit," Jan 8, 2021", Bibury Animation Studios," Comedy, Harem, Romance, School, Shounen",Season ke-2 dari anime Gotoubun no Hanayome.,"[('Gotoubun no Hanayome Season 2 Episode 12 (End) Subtitle Indonesia', 'https://otakudesu.moe/gnh-s2-episode-12-sub-indo/', '4 April,2021', 'https://desustream.me/moedesu/?id=T2wyayt5K2FnR2VSM29UclNwQWRpbHhoYVZCRGVqS3o1RWNXT1NuVVFtST0='), ('Gotoubun no Hanayome Season 2 Episode 11 Subtitle Indonesia', 'https://otakudesu.moe/gnh-s2-episode-11-sub-indo/', '4 April,2021', 'https://desustream.me/moedesu/?id=T2wyayt5K2FnR2VSM29UclNwQWRpbmFxZ2dZbXk2Tllab1JvUlNIWFFmdz0='), ('Gotoubun no Hanayome Season 2 Episode 10 Subtitle Indonesia', 'https://otakudesu.moe/gnh-s2-episode-10-sub-indo/', '4 April,2021', 'https://desustream.me/moedesu/?id=T2wyayt5K2FnR2VSM29UclNwQWRpbmVBNmJ6b3VwbDU0VEpYL2JxSHNMMD0='), ('Gotoubun no Hanayome Season 2 Episode 9 Subtitle Indonesia', 'https://otakudesu.moe/gnh-s2-episode-9-sub-indo/', '4 April,2021', 'https://desustream.me/moedesu/?id=TjlCRlJHQ2IwVlVWYllrUXJVRDZhNHpWMEM0MmZNUXhSc0YwdXpRclQwTT0='), ('Gotoubun no Hanayome Season 2 Episode 8 Subtitle Indonesia', 'https://otakudesu.moe/gnh-s2-episode-8-sub-indo/', '4 April,2021', 'https://desustream.me/moedesu/?id=OFJRNTZEM0FYMy8wa1U5MVZxcHBySjdWNmxDL2syOHVBQmxHSVZ5NkJVST0='), ('Gotoubun no Hanayome Season 2 Episode 7 Subtitle Indonesia', 'https://otakudesu.moe/gnh-s2-episode-7-sub-indo/', '4 April,2021', 'https://desustream.me/moedesu/?id=bFBqeVRGWm1lVjJKY0pzZDVTcDBoZkVqTjI0bzNoc3pZYVFrOFRraXpxZz0='), ('Gotoubun no Hanayome Season 2 Episode 6 Subtitle Indonesia', 'https://otakudesu.moe/gnh-s2-episode-6-sub-indo/', '4 April,2021', 'https://desustream.me/moedesu/?id=d2lBYW51S09SUzAyN3kvRGM2R0JtWUEzL3JBMzg4L1cxWlBzNnQ3SnhwOD0='), ('Gotoubun no Hanayome Season 2 Episode 5 Subtitle Indonesia', 'https://otakudesu.moe/gnh-s2-episode-5-sub-indo/', '4 April,2021', 'https://desustream.me/moedesu/?id=dHVJN2FycjBjVnlmaW5lM25ENUFQNkI3NmxKbVJidjF5Sk5zU2dGeFpIND0='), ('Gotoubun no Hanayome Season 2 Episode 4 Subtitle Indonesia', 'https://otakudesu.moe/gnh-s2-episode-4-sub-indo/', '4 April,2021', 'https://desustream.me/moedesu/?id=TTY2OWFVbW1XaEJnM3lRODV5MEJZK3F4eFU3VVhpMHN1UFNWaWs1TTRQVT0='), ('Gotoubun no Hanayome Season 2 Episode 3 Subtitle Indonesia', 'https://otakudesu.moe/gnh-s2-episode-3-sub-indo/', '4 April,2021', 'https://desustream.me/moedesu/?id=UG5jWU9MVERLRHROOTFHUjVCYmZWbFV3RGpFWjFLcmcrOHA0WFRNMVpTdz0='), ('Gotoubun no Hanayome Season 2 Episode 2 Subtitle Indonesia', 'https://otakudesu.moe/gnh-s2-episode-2-sub-indo/', '4 April,2021', 'https://desustream.me/moedesu/?id=WVp0WW96VUV1aURKZk82YkM2alp1M2tITkh2N1NIcFJrWGhwQnJXb0FTbz0='), ('Gotoubun no Hanayome Season 2 Episode 1 Subtitle Indonesia', 'https://otakudesu.moe/gnh-s2-episode-1-sub-indo/', '4 April,2021', 'https://desustream.me/moedesu/?id=T2wyayt5K2FnR2VSM29UclNwQWRpa3BWR1RmZXpTUEhQc0RVTFIwazhPQT0=')]"
anime315,Granbelm,Granbelm (Episode 1 – 12) Subtitle Indonesia,https://i0.wp.com/otakudesu.moe/wp-content/uploads/2019/07/Granbelm-Sub-Indo.jpg, Granbelm, グランベルム, 7.00, Infinite, TV, Completed, 12, 24 Menit," Jul 6, 2019", Nexus," Fantasy, Magic","Walaupun hari mulai gelap, sore itu Mangetsu tetap berencana untuk mengambil bekal makanan yang tertinggal di sekolahnya. Namun ada sesuatu yang mengganjal perasannnya, sore itu bulan nampak lebih besar dan tampak lebih terang. Suasana juga terasa lebih mencekam saat ia sampai di sekolahnya.Tiba-tiba saja Mangetsu sadar bahwa dirinya telah berada di dunia lain, sebuah tempat yang sangat berbeda dari rumahnya. Dihadapannya, terdapat robot yang sedang bertempur. Beberapa robot tersebut mengincar dirinya, dan ada satu yang berusaha menyelamatkannya, ia adalah Shingetsu.Setelah berhasil mengalahkan beberapa musuhnya akhirnya Shingetsu menjelaskan kepada Mangetsu bahwa ini merupakan dunia sihir, mereka adalah penyihir yang mengendalikan ARMANOX, sebuah robot yang dikendalikan menggunakan hati para penyihir.Dan kini, pertempuran Granbelm yang diadakan setiap bulan purnama untuk menentukan princeps (penyihir sejati) dimulai. Apa yang harus Mangetsu lakukan di tengah ketidaktahuannya tentang dunia yang baru ia ketahui ini?","[('Granbelm Episode 13 (End) Subtitle Indonesia', 'https://otakudesu.moe/gbrml-episode-13-sub-indo/', '30 September,2019', 'https://desustream.me/desudrive/player.php?id=UE5LRS83VkErb3dXbERYM2Y0WlErMWIvcGc1dnVBTmJBT0kzM3YwVTFrMTZGM2tIU1NtcVhKNkRsL0w3eUgrZA=='), ('Granbelm Episode 12 Subtitle Indonesia', 'https://otakudesu.moe/gbrml-episode-12-sub-indo/', '30 September,2019', 'https://desustream.me/desudrive/player.php?id=dCtCNnRZemdHQlZFOFlLTnBNVTFPc0JMQmNLRzFGZzRRTXUrcm5KbXh3STFOajNkNFlqOGh0cXllS0xJTHpQag=='), ('Granbelm Episode 11 Subtitle Indonesia', 'https://otakudesu.moe/gbrml-episode-11-sub-indo/', '30 September,2019', 'https://desustream.me/desudrive/player.php?id=ay9meDBVcU8zY0FNejFJNk50SWY1UHdLOVhIb0h2OVR6MXdIRCtONldjZHZ6YTRHMEpSTFpoRFJGVnpNL2R3Tg=='), ('Granbelm Episode 10 Subtitle Indonesia', 'https://otakudesu.moe/gbrml-episode-10-sub-indo/', '30 September,2019', 'https://desustream.me/desudrive/player.php?id=MHk2SFRIa2tEMEhSb1FWc0ZKZXMxZWFLZXliUnA5VEQ4L29RWVlsdzRNeFVMV3RGR2lFSDlMMzMycHFueTRvNg=='), ('Granbelm Episode 9 Subtitle Indonesia', 'https://otakudesu.moe/gbrml-episode-9-sub-indo/', '30 September,2019', 'https://desustream.me/desudrive/player.php?id=bERxZVh6VWZXQTdIaVBGQ04xN2N3bGd1MHYwemVUOC95WmlBM2N6U1YzdVpxRzgzV1U4b2hxTTR5Y1E1czhOaA=='), ('Granbelm Episode 8 Subtitle Indonesia', 'https://otakudesu.moe/gbrml-episode-8-sub-indo/', '30 September,2019', 'https://desustream.me/desudrive/player.php?id=NHdBelY2ZlgzcFpGb1lma3lxQTNackxNVFNNOGwzMCtNcXVtNWhSMmpJOHNOWXRWTzJrRjZ1dk5QVUJXVFp0VQ=='), ('Granbelm Episode 7 Subtitle Indonesia', 'https://otakudesu.moe/gbrml-episode-7-sub-indo/', '30 September,2019', 'https://desustream.me/desudrive/player.php?id=aGZIM0tLU3VwRkh1NUlGa21hOUcyTzEvQlZxMEJhWWNWd1hPL2FvbEl0V2VhektpWklhamZJVndNclVrWVp1eA=='), ('Granbelm Episode 6 Subtitle Indonesia', 'https://otakudesu.moe/gbrml-episode-6-sub-indo/', '30 September,2019', 'https://desustream.me/desudrive/player.php?id=eU1GYTk2V2dzSDQ2VkdrakZPMjYrM3hLM0pzQy9TU2M3bTJMVjZuVUdOUjlCQXNudlJuTW9oSDcrK2syZ0cvWg=='), ('Granbelm Episode 5 Subtitle Indonesia', 'https://otakudesu.moe/gbrml-episode-5-sub-indo/', '30 September,2019', 'https://desustream.me/desudrive/player.php?id=VUFQa2NkanF3cEJ3OUc3ZkdVMCtFNHdadkFtdTJ3eUttRXV2dDRMWi8wSVdnODcyUENFaXpWVEpWWEFzaGZwVQ=='), ('Granbelm Episode 4 Subtitle Indonesia', 'https://otakudesu.moe/gbrml-episode-4-sub-indo/', '30 September,2019', 'https://desustream.me/desudrive/player.php?id=R29JLzdhczIvQjl1RkQyT3dLZ3NtNVNjQzJLdjFvY2N2OS9xYkgxQ240eW8vY1FWOGI0dG9vS2U3ZGd0bWd4dQ=='), ('Granbelm Episode 3 Subtitle Indonesia', 'https://otakudesu.moe/gbrml-episode-3-sub-indo/', '30 September,2019', 'https://desustream.me/desudrive/player.php?id=SVBHRFozdTE3ejU1cnBmczMxYlg4NUl4ckF5dFpqdUJqa0k0ZDFlRExwRXJxZmNxeUx0VitUTkROcDhCVWJmOA=='), ('Granbelm Episode 2 Subtitle Indonesia', 'https://otakudesu.moe/gbrml-episode-2-sub-indo/', '30 September,2019', 'https://desustream.me/desudrive/player.php?id=MXBpWXBud3RzNnR5YWo5N0ZxOGV6RGNLUmRLajFuUjNMYlUvWmtGV2loV2thTHZTZVhXeVA0MFptTFVPQ250Ug=='), ('Granbelm Episode 1 Subtitle Indonesia', 'https://otakudesu.moe/gbrml-episode-1-sub-indo/', '30 September,2019', 'https://desustream.me/desudrive/player.php?id=NkkwQTNQazZ1NU42eWhsMzIyUDAzR1I4YXpGZWNsZ2tQdHkwbWVWcDRweVhvZE5LZWlOc0hrckdzTTRqUVBVVA==')]"
